[I 2026-05-18 19:34:50,657] A new study created in RDB with name: nsga_Spectrum-KAN

============================================================
  NSGA-II Optimization: Spectrum-KAN (30 trials)
============================================================
Running 29 trials for Spectrum-KAN (already have 1)
  0%|          | 0/29 [00:00<?, ?it/s]                                        0%|          | 0/29 [16:00<?, ?it/s]  3%|▎         | 1/29 [16:00<7:28:04, 960.15s/it]                                                   3%|▎         | 1/29 [27:01<7:28:04, 960.15s/it]  7%|▋         | 2/29 [27:01<5:52:56, 784.31s/it]                                                   7%|▋         | 2/29 [36:05<5:52:56, 784.31s/it] 10%|█         | 3/29 [36:05<4:52:17, 674.53s/it]                                                  10%|█         | 3/29 [49:11<4:52:17, 674.53s/it] 14%|█▍        | 4/29 [49:11<4:59:23, 718.53s/it]                                                  14%|█▍        | 4/29 [1:09:19<4:59:23, 718.53s/it] 17%|█▋        | 5/29 [1:09:19<5:58:06, 895.28s/it]                                                    17%|█▋        | 5/29 [1:21:56<5:58:06, 895.28s/it] 21%|██        | 6/29 [1:21:56<5:25:04, 848.04s/it]                                                    21%|██        | 6/29 [1:39:42<5:25:04, 848.04s/it] 24%|██▍       | 7/29 [1:39:42<5:37:05, 919.36s/it]
  Task: Thiram Presence (has_thiram), classes=[0, 1], samples=901
    Spectrum-KAN: F1=0.741±0.155, BA=0.757±0.151, Acc=0.780±0.154

  Task: MG Presence (has_mg), classes=[0, 1], samples=901
    Spectrum-KAN: F1=0.610±0.170, BA=0.617±0.160, Acc=0.704±0.123

  Task: MBA Presence (has_mba), classes=[0, 1], samples=901
    Spectrum-KAN: F1=0.864±0.074, BA=0.853±0.081, Acc=0.904±0.066

  Task: Thiram Positive Molar Grade (c_thiram), classes=[4, 5, 6], samples=650
    Spectrum-KAN: F1=0.654±0.076, BA=0.714±0.083, Acc=0.646±0.079

  Task: MG Positive Molar Grade (c_mg), classes=[4, 5, 6], samples=648
    Spectrum-KAN: F1=0.555±0.201, BA=0.546±0.221, Acc=0.605±0.220

  Task: MBA Positive Molar Grade (c_mba), classes=[4, 5, 6], samples=681
    Spectrum-KAN: F1=0.635±0.116, BA=0.650±0.120, Acc=0.626±0.127
[I 2026-05-18 19:50:50,840] Trial 0 finished with values: [0.5546015196818799, 0.6762920961782264] and parameters: {'lr': 0.0003, 'weight_decay': 0.0001, 'aug_n': 4, 'mixup_alpha': 0.3, 'label_smoothing': 0.1, 'focal_gamma': 2.0, 'class_balance': 'simple'}.

  Task: Thiram Presence (has_thiram), classes=[0, 1], samples=901
    Spectrum-KAN: F1=0.771±0.161, BA=0.795±0.151, Acc=0.793±0.155

  Task: MG Presence (has_mg), classes=[0, 1], samples=901
    Spectrum-KAN: F1=0.538±0.158, BA=0.580±0.138, Acc=0.615±0.151

  Task: MBA Presence (has_mba), classes=[0, 1], samples=901
    Spectrum-KAN: F1=0.874±0.055, BA=0.865±0.068, Acc=0.915±0.038

  Task: Thiram Positive Molar Grade (c_thiram), classes=[4, 5, 6], samples=650
    Spectrum-KAN: F1=0.616±0.210, BA=0.693±0.178, Acc=0.615±0.211

  Task: MG Positive Molar Grade (c_mg), classes=[4, 5, 6], samples=648
    Spectrum-KAN: F1=0.438±0.060, BA=0.454±0.059, Acc=0.503±0.112

  Task: MBA Positive Molar Grade (c_mba), classes=[4, 5, 6], samples=681
    Spectrum-KAN: F1=0.631±0.144, BA=0.638±0.146, Acc=0.634±0.147
[I 2026-05-18 20:01:52,057] Trial 1 finished with values: [0.4381760008303413, 0.6447051323859406] and parameters: {'lr': 0.00018272261776066238, 'weight_decay': 0.002451793204707062, 'aug_n': 2, 'mixup_alpha': 0.14680559213273098, 'label_smoothing': 0.023399178050430396, 'focal_gamma': 1.116167224336399, 'class_balance': 'simple'}.

  Task: Thiram Presence (has_thiram), classes=[0, 1], samples=901
    Spectrum-KAN: F1=0.662±0.180, BA=0.686±0.196, Acc=0.708±0.167

  Task: MG Presence (has_mg), classes=[0, 1], samples=901
    Spectrum-KAN: F1=0.611±0.161, BA=0.613±0.156, Acc=0.704±0.146

  Task: MBA Presence (has_mba), classes=[0, 1], samples=901
    Spectrum-KAN: F1=0.867±0.063, BA=0.860±0.078, Acc=0.910±0.049

  Task: Thiram Positive Molar Grade (c_thiram), classes=[4, 5, 6], samples=650
    Spectrum-KAN: F1=0.629±0.148, BA=0.702±0.120, Acc=0.623±0.165

  Task: MG Positive Molar Grade (c_mg), classes=[4, 5, 6], samples=648
    Spectrum-KAN: F1=0.463±0.093, BA=0.503±0.139, Acc=0.546±0.095

  Task: MBA Positive Molar Grade (c_mba), classes=[4, 5, 6], samples=681
    Spectrum-KAN: F1=0.605±0.122, BA=0.619±0.126, Acc=0.598±0.130
[I 2026-05-18 20:10:55,945] Trial 2 finished with values: [0.46348715023258097, 0.6396087086270623] and parameters: {'lr': 0.0003125514318167613, 'weight_decay': 5.439667429522988e-05, 'aug_n': 2, 'mixup_alpha': 0.16370173320348286, 'label_smoothing': 0.02727374508106509, 'focal_gamma': 1.3668090197068676, 'class_balance': 'effective_number'}.

  Task: Thiram Presence (has_thiram), classes=[0, 1], samples=901
    Spectrum-KAN: F1=0.813±0.143, BA=0.831±0.122, Acc=0.833±0.147

  Task: MG Presence (has_mg), classes=[0, 1], samples=901
    Spectrum-KAN: F1=0.585±0.187, BA=0.588±0.183, Acc=0.685±0.128

  Task: MBA Presence (has_mba), classes=[0, 1], samples=901
    Spectrum-KAN: F1=0.849±0.052, BA=0.846±0.069, Acc=0.895±0.046

  Task: Thiram Positive Molar Grade (c_thiram), classes=[4, 5, 6], samples=650
    Spectrum-KAN: F1=0.639±0.191, BA=0.701±0.158, Acc=0.630±0.211

  Task: MG Positive Molar Grade (c_mg), classes=[4, 5, 6], samples=648
    Spectrum-KAN: F1=0.420±0.102, BA=0.461±0.076, Acc=0.515±0.149

  Task: MBA Positive Molar Grade (c_mba), classes=[4, 5, 6], samples=681
    Spectrum-KAN: F1=0.600±0.154, BA=0.612±0.154, Acc=0.603±0.158
[I 2026-05-18 20:24:01,923] Trial 3 finished with values: [0.4203126022997665, 0.6511733836278998] and parameters: {'lr': 0.0002004087187654155, 'weight_decay': 0.00016474773941090523, 'aug_n': 2, 'mixup_alpha': 0.18764339456056545, 'label_smoothing': 0.05495427649405375, 'focal_gamma': 1.9121399684340719, 'class_balance': 'simple'}.

  Task: Thiram Presence (has_thiram), classes=[0, 1], samples=901
    Spectrum-KAN: F1=0.773±0.108, BA=0.785±0.106, Acc=0.818±0.104

  Task: MG Presence (has_mg), classes=[0, 1], samples=901
    Spectrum-KAN: F1=0.573±0.178, BA=0.584±0.164, Acc=0.666±0.175

  Task: MBA Presence (has_mba), classes=[0, 1], samples=901
    Spectrum-KAN: F1=0.878±0.036, BA=0.878±0.043, Acc=0.912±0.036

  Task: Thiram Positive Molar Grade (c_thiram), classes=[4, 5, 6], samples=650
    Spectrum-KAN: F1=0.659±0.062, BA=0.713±0.075, Acc=0.660±0.078

  Task: MG Positive Molar Grade (c_mg), classes=[4, 5, 6], samples=648
    Spectrum-KAN: F1=0.384±0.084, BA=0.430±0.086, Acc=0.473±0.097

  Task: MBA Positive Molar Grade (c_mba), classes=[4, 5, 6], samples=681
    Spectrum-KAN: F1=0.602±0.158, BA=0.619±0.157, Acc=0.606±0.166
[I 2026-05-18 20:44:10,597] Trial 4 finished with values: [0.38442042821511996, 0.6447702774884857] and parameters: {'lr': 0.00022878863522445903, 'weight_decay': 0.0005654220107550434, 'aug_n': 4, 'mixup_alpha': 0.15115723710618748, 'label_smoothing': 0.009757738947791927, 'focal_gamma': 2.8977710745066663, 'class_balance': 'simple'}.

  Task: Thiram Presence (has_thiram), classes=[0, 1], samples=901
    Spectrum-KAN: F1=0.799±0.139, BA=0.843±0.122, Acc=0.812±0.137

  Task: MG Presence (has_mg), classes=[0, 1], samples=901
    Spectrum-KAN: F1=0.634±0.174, BA=0.642±0.165, Acc=0.743±0.116

  Task: MBA Presence (has_mba), classes=[0, 1], samples=901
    Spectrum-KAN: F1=0.880±0.063, BA=0.865±0.082, Acc=0.922±0.041

  Task: Thiram Positive Molar Grade (c_thiram), classes=[4, 5, 6], samples=650
    Spectrum-KAN: F1=0.591±0.159, BA=0.676±0.130, Acc=0.598±0.175

  Task: MG Positive Molar Grade (c_mg), classes=[4, 5, 6], samples=648
    Spectrum-KAN: F1=0.354±0.108, BA=0.358±0.122, Acc=0.426±0.132

  Task: MBA Positive Molar Grade (c_mba), classes=[4, 5, 6], samples=681
    Spectrum-KAN: F1=0.631±0.158, BA=0.637±0.157, Acc=0.622±0.158
[I 2026-05-18 20:56:46,935] Trial 5 finished with values: [0.3536213918744463, 0.6478952601163143] and parameters: {'lr': 0.00016327356954687938, 'weight_decay': 7.458402142772747e-05, 'aug_n': 2, 'mixup_alpha': 0.13661147045343366, 'label_smoothing': 0.07427653651669053, 'focal_gamma': 1.0687770422304368, 'class_balance': 'simple'}.

  Task: Thiram Presence (has_thiram), classes=[0, 1], samples=901
    Spectrum-KAN: F1=0.814±0.102, BA=0.827±0.073, Acc=0.845±0.104

  Task: MG Presence (has_mg), classes=[0, 1], samples=901
    Spectrum-KAN: F1=0.667±0.159, BA=0.668±0.164, Acc=0.783±0.073

  Task: MBA Presence (has_mba), classes=[0, 1], samples=901
    Spectrum-KAN: F1=0.869±0.080, BA=0.871±0.081, Acc=0.900±0.080

  Task: Thiram Positive Molar Grade (c_thiram), classes=[4, 5, 6], samples=650
    Spectrum-KAN: F1=0.648±0.219, BA=0.718±0.177, Acc=0.641±0.225

  Task: MG Positive Molar Grade (c_mg), classes=[4, 5, 6], samples=648
    Spectrum-KAN: F1=0.434±0.087, BA=0.438±0.090, Acc=0.508±0.169

  Task: MBA Positive Molar Grade (c_mba), classes=[4, 5, 6], samples=681
    Spectrum-KAN: F1=0.641±0.131, BA=0.646±0.136, Acc=0.636±0.130
[I 2026-05-18 21:14:33,143] Trial 6 finished with values: [0.43374088280364276, 0.6788993565027925] and parameters: {'lr': 0.00029045790726652773, 'weight_decay': 0.0001791593359375471, 'aug_n': 4, 'mixup_alpha': 0.15545633665765812, 'label_smoothing': 0.14543769416468377, 'focal_gamma': 2.550265646722229, 'class_balance': 'simple'}.

  Task: Thiram Presence (has_thiram), classes=[0, 1], samples=901
    Spectrum-KAN: F1=0.737±0.121, BA=0.747±0.136, Acc=0.798±0.105                                                    24%|██▍       | 7/29 [1:55:02<5:37:05, 919.36s/it] 28%|██▊       | 8/29 [1:55:02<5:21:48, 919.43s/it]                                                    28%|██▊       | 8/29 [2:09:01<5:21:48, 919.43s/it] 31%|███       | 9/29 [2:09:01<4:58:09, 894.47s/it]                                                    31%|███       | 9/29 [2:28:10<4:58:09, 894.47s/it] 34%|███▍      | 10/29 [2:28:10<5:08:04, 972.89s/it]                                                     34%|███▍      | 10/29 [2:45:42<5:08:04, 972.89s/it] 38%|███▊      | 11/29 [2:45:42<4:59:08, 997.12s/it]                                                     38%|███▊      | 11/29 [2:59:05<4:59:08, 997.12s/it] 41%|████▏     | 12/29 [2:59:05<4:25:51, 938.30s/it]                                                     41%|████▏     | 12/29 [3:12:17<4:25:51, 938.30s/it] 45%|████▍     | 13/29 [3:12:17<3:58:21, 893.83s/it]                                                     45%|████▍     | 13/29 [3:26:27<3:58:21, 893.83s/it] 48%|████▊     | 14/29 [3:26:27<3:40:09, 880.66s/it]

  Task: MG Presence (has_mg), classes=[0, 1], samples=901
    Spectrum-KAN: F1=0.601±0.141, BA=0.597±0.142, Acc=0.719±0.075

  Task: MBA Presence (has_mba), classes=[0, 1], samples=901
    Spectrum-KAN: F1=0.838±0.103, BA=0.833±0.113, Acc=0.891±0.081

  Task: Thiram Positive Molar Grade (c_thiram), classes=[4, 5, 6], samples=650
    Spectrum-KAN: F1=0.660±0.183, BA=0.725±0.151, Acc=0.645±0.198

  Task: MG Positive Molar Grade (c_mg), classes=[4, 5, 6], samples=648
    Spectrum-KAN: F1=0.479±0.161, BA=0.514±0.167, Acc=0.559±0.113

  Task: MBA Positive Molar Grade (c_mba), classes=[4, 5, 6], samples=681
    Spectrum-KAN: F1=0.622±0.122, BA=0.627±0.133, Acc=0.618±0.135
[I 2026-05-18 21:29:52,722] Trial 7 finished with values: [0.4785725858619945, 0.6562583163507273] and parameters: {'lr': 0.00026176655097040057, 'weight_decay': 0.0021787220464104273, 'aug_n': 4, 'mixup_alpha': 0.11356818667316143, 'label_smoothing': 0.04879954961448965, 'focal_gamma': 1.777354579378964, 'class_balance': 'effective_number'}.

  Task: Thiram Presence (has_thiram), classes=[0, 1], samples=901
    Spectrum-KAN: F1=0.710±0.172, BA=0.763±0.131, Acc=0.729±0.186

  Task: MG Presence (has_mg), classes=[0, 1], samples=901
    Spectrum-KAN: F1=0.587±0.157, BA=0.605±0.152, Acc=0.678±0.133

  Task: MBA Presence (has_mba), classes=[0, 1], samples=901
    Spectrum-KAN: F1=0.856±0.055, BA=0.840±0.071, Acc=0.902±0.049

  Task: Thiram Positive Molar Grade (c_thiram), classes=[4, 5, 6], samples=650
    Spectrum-KAN: F1=0.635±0.063, BA=0.704±0.079, Acc=0.653±0.063

  Task: MG Positive Molar Grade (c_mg), classes=[4, 5, 6], samples=648
    Spectrum-KAN: F1=0.374±0.168, BA=0.400±0.157, Acc=0.447±0.222

  Task: MBA Positive Molar Grade (c_mba), classes=[4, 5, 6], samples=681
    Spectrum-KAN: F1=0.628±0.125, BA=0.640±0.123, Acc=0.622±0.135
[I 2026-05-18 21:43:52,309] Trial 8 finished with values: [0.37449794169383643, 0.6320265673444496] and parameters: {'lr': 0.00017756602567007326, 'weight_decay': 0.0001579479719759463, 'aug_n': 2, 'mixup_alpha': 0.34065909422621193, 'label_smoothing': 0.011182596551965624, 'focal_gamma': 2.9737738732010346, 'class_balance': 'simple'}.

  Task: Thiram Presence (has_thiram), classes=[0, 1], samples=901
    Spectrum-KAN: F1=0.722±0.169, BA=0.725±0.161, Acc=0.774±0.149

  Task: MG Presence (has_mg), classes=[0, 1], samples=901
    Spectrum-KAN: F1=0.633±0.156, BA=0.631±0.156, Acc=0.757±0.076

  Task: MBA Presence (has_mba), classes=[0, 1], samples=901
    Spectrum-KAN: F1=0.866±0.044, BA=0.862±0.059, Acc=0.904±0.045

  Task: Thiram Positive Molar Grade (c_thiram), classes=[4, 5, 6], samples=650
    Spectrum-KAN: F1=0.670±0.177, BA=0.735±0.148, Acc=0.653±0.186

  Task: MG Positive Molar Grade (c_mg), classes=[4, 5, 6], samples=648
    Spectrum-KAN: F1=0.433±0.091, BA=0.447±0.099, Acc=0.478±0.148

  Task: MBA Positive Molar Grade (c_mba), classes=[4, 5, 6], samples=681
    Spectrum-KAN: F1=0.641±0.128, BA=0.645±0.131, Acc=0.636±0.132
[I 2026-05-18 22:03:00,805] Trial 9 finished with values: [0.43293837338831065, 0.6607082707527684] and parameters: {'lr': 0.00010089271157862034, 'weight_decay': 0.001409236110165583, 'aug_n': 4, 'mixup_alpha': 0.3313811040057838, 'label_smoothing': 0.011106697760113554, 'focal_gamma': 1.7169314570885452, 'class_balance': 'effective_number'}.

  Task: Thiram Presence (has_thiram), classes=[0, 1], samples=901
    Spectrum-KAN: F1=0.795±0.207, BA=0.815±0.187, Acc=0.811±0.212

  Task: MG Presence (has_mg), classes=[0, 1], samples=901
    Spectrum-KAN: F1=0.614±0.219, BA=0.619±0.213, Acc=0.710±0.183

  Task: MBA Presence (has_mba), classes=[0, 1], samples=901
    Spectrum-KAN: F1=0.860±0.065, BA=0.852±0.077, Acc=0.903±0.057

  Task: Thiram Positive Molar Grade (c_thiram), classes=[4, 5, 6], samples=650
    Spectrum-KAN: F1=0.592±0.203, BA=0.672±0.161, Acc=0.591±0.206

  Task: MG Positive Molar Grade (c_mg), classes=[4, 5, 6], samples=648
    Spectrum-KAN: F1=0.419±0.074, BA=0.432±0.068, Acc=0.494±0.121

  Task: MBA Positive Molar Grade (c_mba), classes=[4, 5, 6], samples=681
    Spectrum-KAN: F1=0.644±0.132, BA=0.652±0.135, Acc=0.642±0.135
[I 2026-05-18 22:20:32,868] Trial 10 finished with values: [0.41880205960494854, 0.6541330710285833] and parameters: {'lr': 0.00027268841927738537, 'weight_decay': 0.00019380132456492117, 'aug_n': 4, 'mixup_alpha': 0.1975549966080241, 'label_smoothing': 0.10944092675070961, 'focal_gamma': 2.2751149427104265, 'class_balance': 'simple'}.

  Task: Thiram Presence (has_thiram), classes=[0, 1], samples=901
    Spectrum-KAN: F1=0.725±0.164, BA=0.749±0.174, Acc=0.759±0.161

  Task: MG Presence (has_mg), classes=[0, 1], samples=901
    Spectrum-KAN: F1=0.584±0.169, BA=0.598±0.162, Acc=0.692±0.135

  Task: MBA Presence (has_mba), classes=[0, 1], samples=901
    Spectrum-KAN: F1=0.877±0.042, BA=0.872±0.053, Acc=0.915±0.033

  Task: Thiram Positive Molar Grade (c_thiram), classes=[4, 5, 6], samples=650
    Spectrum-KAN: F1=0.615±0.165, BA=0.690±0.135, Acc=0.615±0.182

  Task: MG Positive Molar Grade (c_mg), classes=[4, 5, 6], samples=648
    Spectrum-KAN: F1=0.393±0.115, BA=0.406±0.115, Acc=0.443±0.114

  Task: MBA Positive Molar Grade (c_mba), classes=[4, 5, 6], samples=681
    Spectrum-KAN: F1=0.622±0.143, BA=0.646±0.120, Acc=0.621±0.143
[I 2026-05-18 22:33:56,613] Trial 11 finished with values: [0.39273947962747835, 0.6360778762557465] and parameters: {'lr': 0.00012122516686859985, 'weight_decay': 0.000927314636360635, 'aug_n': 2, 'mixup_alpha': 0.3312901539863683, 'label_smoothing': 0.07406933945465861, 'focal_gamma': 2.0454656587639883, 'class_balance': 'simple'}.

  Task: Thiram Presence (has_thiram), classes=[0, 1], samples=901
    Spectrum-KAN: F1=0.824±0.138, BA=0.852±0.118, Acc=0.840±0.138

  Task: MG Presence (has_mg), classes=[0, 1], samples=901
    Spectrum-KAN: F1=0.583±0.173, BA=0.593±0.163, Acc=0.678±0.151

  Task: MBA Presence (has_mba), classes=[0, 1], samples=901
    Spectrum-KAN: F1=0.914±0.049, BA=0.907±0.055, Acc=0.935±0.049

  Task: Thiram Positive Molar Grade (c_thiram), classes=[4, 5, 6], samples=650
    Spectrum-KAN: F1=0.553±0.213, BA=0.629±0.206, Acc=0.583±0.155

  Task: MG Positive Molar Grade (c_mg), classes=[4, 5, 6], samples=648
    Spectrum-KAN: F1=0.447±0.080, BA=0.493±0.109, Acc=0.525±0.118

  Task: MBA Positive Molar Grade (c_mba), classes=[4, 5, 6], samples=681
    Spectrum-KAN: F1=0.586±0.157, BA=0.599±0.156, Acc=0.590±0.157
[I 2026-05-18 22:47:08,115] Trial 12 finished with values: [0.44703651147390355, 0.6512695527156215] and parameters: {'lr': 0.00011896326393433524, 'weight_decay': 5.6866415006646447e-05, 'aug_n': 2, 'mixup_alpha': 0.25257120734941085, 'label_smoothing': 0.13613497108891395, 'focal_gamma': 1.4985844582977499, 'class_balance': 'effective_number'}.

  Task: Thiram Presence (has_thiram), classes=[0, 1], samples=901
    Spectrum-KAN: F1=0.791±0.212, BA=0.825±0.211, Acc=0.806±0.214

  Task: MG Presence (has_mg), classes=[0, 1], samples=901
    Spectrum-KAN: F1=0.601±0.165, BA=0.617±0.161, Acc=0.671±0.163

  Task: MBA Presence (has_mba), classes=[0, 1], samples=901
    Spectrum-KAN: F1=0.863±0.072, BA=0.868±0.077, Acc=0.899±0.066

  Task: Thiram Positive Molar Grade (c_thiram), classes=[4, 5, 6], samples=650
    Spectrum-KAN: F1=0.651±0.072, BA=0.714±0.082, Acc=0.649±0.097

  Task: MG Positive Molar Grade (c_mg), classes=[4, 5, 6], samples=648
    Spectrum-KAN: F1=0.463±0.137, BA=0.481±0.145, Acc=0.505±0.148

  Task: MBA Positive Molar Grade (c_mba), classes=[4, 5, 6], samples=681
    Spectrum-KAN: F1=0.648±0.094, BA=0.654±0.096, Acc=0.637±0.101
[I 2026-05-18 23:01:18,348] Trial 13 finished with values: [0.462571316950954, 0.6692449426919307] and parameters: {'lr': 0.00014451837004705447, 'weight_decay': 6.852545490110174e-05, 'aug_n': 2, 'mixup_alpha': 0.378909295702772, 'label_smoothing': 0.12121805693466253, 'focal_gamma': 2.266807513020847, 'class_balance': 'simple'}.

  Task: Thiram Presence (has_thiram), classes=[0, 1], samples=901
    Spectrum-KAN: F1=0.708±0.120, BA=0.723±0.133, Acc=0.772±0.093

  Task: MG Presence (has_mg), classes=[0, 1], samples=901                                                     48%|████▊     | 14/29 [3:41:41<3:40:09, 880.66s/it] 52%|█████▏    | 15/29 [3:41:41<3:27:49, 890.69s/it]                                                     52%|█████▏    | 15/29 [3:56:11<3:27:49, 890.69s/it] 55%|█████▌    | 16/29 [3:56:11<3:11:38, 884.53s/it]                                                     55%|█████▌    | 16/29 [4:10:28<3:11:38, 884.53s/it] 59%|█████▊    | 17/29 [4:10:28<2:55:14, 876.25s/it]                                                     59%|█████▊    | 17/29 [4:25:00<2:55:14, 876.25s/it] 62%|██████▏   | 18/29 [4:25:00<2:40:24, 874.92s/it]                                                     62%|██████▏   | 18/29 [4:42:38<2:40:24, 874.92s/it] 66%|██████▌   | 19/29 [4:42:38<2:34:58, 929.88s/it]                                                     66%|██████▌   | 19/29 [4:56:16<2:34:58, 929.88s/it] 69%|██████▉   | 20/29 [4:56:16<2:14:25, 896.22s/it]