[I 2026-05-18 18:30:55,513] Trial 92 finished with values: [0.4823437422158146, 0.7577380380442439] and parameters: {'n_estimators': 600, 'max_depth': 14, 'min_samples_leaf': 1, 'max_features': 0.16974657160199658, 'class_weight': 'balanced_subsample'}.

  Task: Thiram Presence (has_thiram), classes=[0, 1], samples=901
    RF: F1=0.824±0.108, BA=0.805±0.097, Acc=0.869±0.078

  Task: MG Presence (has_mg), classes=[0, 1], samples=901
    RF: F1=0.793±0.045, BA=0.775±0.043, Acc=0.850±0.037

  Task: MBA Presence (has_mba), classes=[0, 1], samples=901
    RF: F1=0.861±0.079, BA=0.865±0.084, Acc=0.897±0.067

  Task: Thiram Positive Molar Grade (c_thiram), classes=[4, 5, 6], samples=650
    RF: F1=0.793±0.113, BA=0.843±0.084, Acc=0.789±0.118

  Task: MG Positive Molar Grade (c_mg), classes=[4, 5, 6], samples=648
    RF: F1=0.485±0.095, BA=0.515±0.124, Acc=0.577±0.149

  Task: MBA Positive Molar Grade (c_mba), classes=[4, 5, 6], samples=681
    RF: F1=0.770±0.091, BA=0.777±0.095, Acc=0.761±0.104
[I 2026-05-18 18:32:54,793] Trial 93 finished with values: [0.48524172900589163, 0.754377811735794] and parameters: {'n_estimators': 1100, 'max_depth': 11, 'min_samples_leaf': 1, 'max_features': 0.16432322056699947, 'class_weight': 'balanced_subsample'}.

  Task: Thiram Presence (has_thiram), classes=[0, 1], samples=901
    RF: F1=0.858±0.079, BA=0.856±0.075, Acc=0.885±0.073

  Task: MG Presence (has_mg), classes=[0, 1], samples=901
    RF: F1=0.818±0.077, BA=0.815±0.071, Acc=0.859±0.063

  Task: MBA Presence (has_mba), classes=[0, 1], samples=901
    RF: F1=0.862±0.077, BA=0.871±0.082, Acc=0.896±0.067

  Task: Thiram Positive Molar Grade (c_thiram), classes=[4, 5, 6], samples=650
    RF: F1=0.783±0.108, BA=0.830±0.085, Acc=0.780±0.112

  Task: MG Positive Molar Grade (c_mg), classes=[4, 5, 6], samples=648
    RF: F1=0.501±0.089, BA=0.531±0.117, Acc=0.591±0.152

  Task: MBA Positive Molar Grade (c_mba), classes=[4, 5, 6], samples=681
    RF: F1=0.794±0.072, BA=0.805±0.067, Acc=0.785±0.082
[I 2026-05-18 18:33:31,686] Trial 94 finished with values: [0.501467189520812, 0.7692837805286611] and parameters: {'n_estimators': 300, 'max_depth': 10, 'min_samples_leaf': 7, 'max_features': 0.17462802355441434, 'class_weight': 'balanced_subsample'}.

  Task: Thiram Presence (has_thiram), classes=[0, 1], samples=901
    RF: F1=0.856±0.080, BA=0.855±0.075, Acc=0.883±0.075

  Task: MG Presence (has_mg), classes=[0, 1], samples=901
    RF: F1=0.815±0.085, BA=0.812±0.082, Acc=0.857±0.070

  Task: MBA Presence (has_mba), classes=[0, 1], samples=901
    RF: F1=0.867±0.069, BA=0.876±0.074, Acc=0.899±0.062

  Task: Thiram Positive Molar Grade (c_thiram), classes=[4, 5, 6], samples=650
    RF: F1=0.784±0.108, BA=0.831±0.084, Acc=0.782±0.112

  Task: MG Positive Molar Grade (c_mg), classes=[4, 5, 6], samples=648
    RF: F1=0.499±0.090, BA=0.528±0.117, Acc=0.590±0.152

  Task: MBA Positive Molar Grade (c_mba), classes=[4, 5, 6], samples=681
    RF: F1=0.795±0.070, BA=0.806±0.063, Acc=0.785±0.080
[I 2026-05-18 18:34:59,436] Trial 95 finished with values: [0.49917585375333484, 0.7693603413681389] and parameters: {'n_estimators': 800, 'max_depth': 26, 'min_samples_leaf': 7, 'max_features': 0.18970772378422393, 'class_weight': 'balanced_subsample'}.

  Task: Thiram Presence (has_thiram), classes=[0, 1], samples=901
    RF: F1=0.854±0.079, BA=0.850±0.073, Acc=0.882±0.075

  Task: MG Presence (has_mg), classes=[0, 1], samples=901
    RF: F1=0.818±0.081, BA=0.813±0.078, Acc=0.861±0.064

  Task: MBA Presence (has_mba), classes=[0, 1], samples=901
    RF: F1=0.872±0.066, BA=0.879±0.075, Acc=0.903±0.058

  Task: Thiram Positive Molar Grade (c_thiram), classes=[4, 5, 6], samples=650
    RF: F1=0.783±0.108, BA=0.830±0.085, Acc=0.780±0.112

  Task: MG Positive Molar Grade (c_mg), classes=[4, 5, 6], samples=648
    RF: F1=0.500±0.089, BA=0.529±0.117, Acc=0.591±0.151

  Task: MBA Positive Molar Grade (c_mba), classes=[4, 5, 6], samples=681
    RF: F1=0.790±0.070, BA=0.801±0.065, Acc=0.779±0.082
[I 2026-05-18 18:36:28,464] Trial 96 finished with values: [0.5003756959529142, 0.7694913816495667] and parameters: {'n_estimators': 800, 'max_depth': 16, 'min_samples_leaf': 6, 'max_features': 0.15795794883648925, 'class_weight': 'balanced_subsample'}.

  Task: Thiram Presence (has_thiram), classes=[0, 1], samples=901
    RF: F1=0.817±0.113, BA=0.797±0.101, Acc=0.864±0.083                                                   97%|█████████▋| 97/100 [2:03:39<03:58, 79.60s/it] 98%|█████████▊| 98/100 [2:03:39<02:38, 79.01s/it]                                                   98%|█████████▊| 98/100 [2:05:08<02:38, 79.01s/it] 99%|█████████▉| 99/100 [2:05:08<01:21, 81.91s/it]                                                   99%|█████████▉| 99/100 [2:05:59<01:21, 81.91s/it]100%|██████████| 100/100 [2:05:59<00:00, 72.81s/it]100%|██████████| 100/100 [2:05:59<00:00, 75.60s/it]


  Task: MG Presence (has_mg), classes=[0, 1], samples=901
    RF: F1=0.799±0.054, BA=0.784±0.050, Acc=0.851±0.046

  Task: MBA Presence (has_mba), classes=[0, 1], samples=901
    RF: F1=0.866±0.067, BA=0.869±0.074, Acc=0.900±0.059

  Task: Thiram Positive Molar Grade (c_thiram), classes=[4, 5, 6], samples=650
    RF: F1=0.793±0.112, BA=0.843±0.084, Acc=0.789±0.118

  Task: MG Positive Molar Grade (c_mg), classes=[4, 5, 6], samples=648
    RF: F1=0.486±0.097, BA=0.516±0.125, Acc=0.579±0.154

  Task: MBA Positive Molar Grade (c_mba), classes=[4, 5, 6], samples=681
    RF: F1=0.783±0.084, BA=0.791±0.083, Acc=0.771±0.098
[I 2026-05-18 18:37:46,107] Trial 97 finished with values: [0.486394248167408, 0.7572944554342177] and parameters: {'n_estimators': 700, 'max_depth': 14, 'min_samples_leaf': 2, 'max_features': 0.17462802355441434, 'class_weight': 'balanced_subsample'}.

  Task: Thiram Presence (has_thiram), classes=[0, 1], samples=901
    RF: F1=0.820±0.113, BA=0.803±0.100, Acc=0.863±0.091

  Task: MG Presence (has_mg), classes=[0, 1], samples=901
    RF: F1=0.808±0.061, BA=0.795±0.056, Acc=0.857±0.049

  Task: MBA Presence (has_mba), classes=[0, 1], samples=901
    RF: F1=0.868±0.069, BA=0.871±0.071, Acc=0.900±0.062

  Task: Thiram Positive Molar Grade (c_thiram), classes=[4, 5, 6], samples=650
    RF: F1=0.797±0.113, BA=0.845±0.084, Acc=0.793±0.119

  Task: MG Positive Molar Grade (c_mg), classes=[4, 5, 6], samples=648
    RF: F1=0.485±0.098, BA=0.517±0.126, Acc=0.580±0.155

  Task: MBA Positive Molar Grade (c_mba), classes=[4, 5, 6], samples=681
    RF: F1=0.785±0.076, BA=0.796±0.071, Acc=0.774±0.089
[I 2026-05-18 18:39:14,789] Trial 98 finished with values: [0.48497711951515843, 0.7604031307037368] and parameters: {'n_estimators': 800, 'max_depth': 32, 'min_samples_leaf': 3, 'max_features': 0.20071291833014568, 'class_weight': 'balanced_subsample'}.

  Task: Thiram Presence (has_thiram), classes=[0, 1], samples=901
    RF: F1=0.859±0.083, BA=0.856±0.077, Acc=0.886±0.076

  Task: MG Presence (has_mg), classes=[0, 1], samples=901
    RF: F1=0.818±0.066, BA=0.808±0.061, Acc=0.862±0.053

  Task: MBA Presence (has_mba), classes=[0, 1], samples=901
    RF: F1=0.873±0.068, BA=0.879±0.073, Acc=0.903±0.061

  Task: Thiram Positive Molar Grade (c_thiram), classes=[4, 5, 6], samples=650
    RF: F1=0.788±0.112, BA=0.836±0.086, Acc=0.785±0.117

  Task: MG Positive Molar Grade (c_mg), classes=[4, 5, 6], samples=648
    RF: F1=0.492±0.094, BA=0.521±0.122, Acc=0.586±0.153

  Task: MBA Positive Molar Grade (c_mba), classes=[4, 5, 6], samples=681
    RF: F1=0.786±0.078, BA=0.797±0.073, Acc=0.774±0.091
[I 2026-05-18 18:40:06,361] Trial 99 finished with values: [0.4918577792232769, 0.7692008817498235] and parameters: {'n_estimators': 600, 'max_depth': 16, 'min_samples_leaf': 4, 'max_features': 0.15579754426081674, 'class_weight': 'balanced'}.

RF: 9 Pareto-optimal trials found.
  rf_nsga_best_01: G2=0.5046, All=0.7693, params={'n_estimators': 800, 'max_depth': 30, 'min_samples_leaf': 7, 'max_features': 0.17462802355441434, 'class_weight': 'balanced_subsample'}

  Task: Thiram Presence (has_thiram), classes=[0, 1], samples=901
    RF: F1=0.856±0.081, BA=0.854±0.077, Acc=0.883±0.076

  Task: MG Presence (has_mg), classes=[0, 1], samples=901
    RF: F1=0.816±0.078, BA=0.813±0.073, Acc=0.858±0.064

  Task: MBA Presence (has_mba), classes=[0, 1], samples=901
    RF: F1=0.864±0.071, BA=0.872±0.077, Acc=0.897±0.063

  Task: Thiram Positive Molar Grade (c_thiram), classes=[4, 5, 6], samples=650
    RF: F1=0.784±0.106, BA=0.832±0.082, Acc=0.781±0.110

  Task: MG Positive Molar Grade (c_mg), classes=[4, 5, 6], samples=648
    RF: F1=0.505±0.087, BA=0.534±0.115, Acc=0.595±0.151

  Task: MBA Positive Molar Grade (c_mba), classes=[4, 5, 6], samples=681
    RF: F1=0.792±0.072, BA=0.802±0.066, Acc=0.782±0.082
  Results saved to /hy-tmp/project/data/pure63_mainline/models/mainline_formal_experiment/02_representative_model_optimization/trials/rf_nsga_best_01
  rf_nsga_best_02: G2=0.5046, All=0.7693, params={'n_estimators': 800, 'max_depth': 16, 'min_samples_leaf': 7, 'max_features': 0.17462802355441434, 'class_weight': 'balanced_subsample'}

  Task: Thiram Presence (has_thiram), classes=[0, 1], samples=901
    RF: F1=0.856±0.081, BA=0.854±0.077, Acc=0.883±0.076

  Task: MG Presence (has_mg), classes=[0, 1], samples=901
    RF: F1=0.816±0.078, BA=0.813±0.073, Acc=0.858±0.064

  Task: MBA Presence (has_mba), classes=[0, 1], samples=901
    RF: F1=0.864±0.071, BA=0.872±0.077, Acc=0.897±0.063

  Task: Thiram Positive Molar Grade (c_thiram), classes=[4, 5, 6], samples=650
    RF: F1=0.784±0.106, BA=0.832±0.082, Acc=0.781±0.110

  Task: MG Positive Molar Grade (c_mg), classes=[4, 5, 6], samples=648
    RF: F1=0.505±0.087, BA=0.534±0.115, Acc=0.595±0.151

  Task: MBA Positive Molar Grade (c_mba), classes=[4, 5, 6], samples=681
    RF: F1=0.792±0.072, BA=0.802±0.066, Acc=0.782±0.082
  Results saved to /hy-tmp/project/data/pure63_mainline/models/mainline_formal_experiment/02_representative_model_optimization/trials/rf_nsga_best_02
  rf_nsga_best_03: G2=0.5022, All=0.7702, params={'n_estimators': 800, 'max_depth': 10, 'min_samples_leaf': 8, 'max_features': 0.2114585856946446, 'class_weight': 'balanced_subsample'}

  Task: Thiram Presence (has_thiram), classes=[0, 1], samples=901
    RF: F1=0.848±0.094, BA=0.846±0.090, Acc=0.877±0.085

  Task: MG Presence (has_mg), classes=[0, 1], samples=901
    RF: F1=0.812±0.085, BA=0.810±0.081, Acc=0.855±0.068

  Task: MBA Presence (has_mba), classes=[0, 1], samples=901
    RF: F1=0.871±0.071, BA=0.878±0.074, Acc=0.901±0.063

  Task: Thiram Positive Molar Grade (c_thiram), classes=[4, 5, 6], samples=650
    RF: F1=0.791±0.104, BA=0.836±0.079, Acc=0.788±0.109

  Task: MG Positive Molar Grade (c_mg), classes=[4, 5, 6], samples=648
    RF: F1=0.502±0.093, BA=0.529±0.118, Acc=0.591±0.151

  Task: MBA Positive Molar Grade (c_mba), classes=[4, 5, 6], samples=681
    RF: F1=0.797±0.067, BA=0.810±0.060, Acc=0.789±0.076
  Results saved to /hy-tmp/project/data/pure63_mainline/models/mainline_formal_experiment/02_representative_model_optimization/trials/rf_nsga_best_03
  rf_nsga_best_04: G2=0.5012, All=0.7704, params={'n_estimators': 700, 'max_depth': 22, 'min_samples_leaf': 7, 'max_features': 0.19971689165954998, 'class_weight': 'balanced_subsample'}

  Task: Thiram Presence (has_thiram), classes=[0, 1], samples=901
    RF: F1=0.850±0.093, BA=0.848±0.089, Acc=0.878±0.085

  Task: MG Presence (has_mg), classes=[0, 1], samples=901
    RF: F1=0.812±0.079, BA=0.808±0.074, Acc=0.855±0.067

  Task: MBA Presence (has_mba), classes=[0, 1], samples=901
    RF: F1=0.872±0.068, BA=0.879±0.075, Acc=0.903±0.060

  Task: Thiram Positive Molar Grade (c_thiram), classes=[4, 5, 6], samples=650
    RF: F1=0.788±0.108, BA=0.833±0.083, Acc=0.785±0.113

  Task: MG Positive Molar Grade (c_mg), classes=[4, 5, 6], samples=648
    RF: F1=0.501±0.087, BA=0.530±0.114, Acc=0.592±0.150

  Task: MBA Positive Molar Grade (c_mba), classes=[4, 5, 6], samples=681
    RF: F1=0.798±0.067, BA=0.811±0.060, Acc=0.789±0.077
  Results saved to /hy-tmp/project/data/pure63_mainline/models/mainline_formal_experiment/02_representative_model_optimization/trials/rf_nsga_best_04
  rf_nsga_best_05: G2=0.5035, All=0.7701, params={'n_estimators': 600, 'max_depth': 11, 'min_samples_leaf': 5, 'max_features': 0.17462802355441434, 'class_weight': 'balanced_subsample'}

  Task: Thiram Presence (has_thiram), classes=[0, 1], samples=901
    RF: F1=0.857±0.077, BA=0.854±0.071, Acc=0.885±0.071

  Task: MG Presence (has_mg), classes=[0, 1], samples=901
    RF: F1=0.816±0.073, BA=0.811±0.068, Acc=0.859±0.060

  Task: MBA Presence (has_mba), classes=[0, 1], samples=901
    RF: F1=0.872±0.067, BA=0.880±0.076, Acc=0.903±0.059

  Task: Thiram Positive Molar Grade (c_thiram), classes=[4, 5, 6], samples=650
    RF: F1=0.787±0.110, BA=0.834±0.086, Acc=0.784±0.115

  Task: MG Positive Molar Grade (c_mg), classes=[4, 5, 6], samples=648
    RF: F1=0.503±0.088, BA=0.533±0.116, Acc=0.594±0.151/hy-tmp/project/run_nsga_optimization.py:232: ExperimentalWarning: optuna.visualization.matplotlib._pareto_front.plot_pareto_front is experimental (supported from v2.8.0). The interface can change in the future.
  fig = plot_pf(study, target_names=['mean_f1_g2', 'mean_f1_all'])
/hy-tmp/project/run_nsga_optimization.py:244: ExperimentalWarning: optuna.visualization.matplotlib._param_importances.plot_param_importances is experimental (supported from v2.2.0). The interface can change in the future.
  fig = plot_param_importances(study, target=lambda t: t.values[0],


  Task: MBA Positive Molar Grade (c_mba), classes=[4, 5, 6], samples=681
    RF: F1=0.784±0.073, BA=0.795±0.069, Acc=0.774±0.085
  Results saved to /hy-tmp/project/data/pure63_mainline/models/mainline_formal_experiment/02_representative_model_optimization/trials/rf_nsga_best_05
  rf_nsga_best_06: G2=0.5046, All=0.7693, params={'n_estimators': 800, 'max_depth': 14, 'min_samples_leaf': 7, 'max_features': 0.17462802355441434, 'class_weight': 'balanced_subsample'}

  Task: Thiram Presence (has_thiram), classes=[0, 1], samples=901
    RF: F1=0.856±0.081, BA=0.854±0.077, Acc=0.883±0.076

  Task: MG Presence (has_mg), classes=[0, 1], samples=901
    RF: F1=0.816±0.078, BA=0.813±0.073, Acc=0.858±0.064

  Task: MBA Presence (has_mba), classes=[0, 1], samples=901
    RF: F1=0.864±0.071, BA=0.872±0.077, Acc=0.897±0.063

  Task: Thiram Positive Molar Grade (c_thiram), classes=[4, 5, 6], samples=650
    RF: F1=0.784±0.106, BA=0.832±0.082, Acc=0.781±0.110

  Task: MG Positive Molar Grade (c_mg), classes=[4, 5, 6], samples=648
    RF: F1=0.505±0.087, BA=0.534±0.115, Acc=0.595±0.151

  Task: MBA Positive Molar Grade (c_mba), classes=[4, 5, 6], samples=681
    RF: F1=0.792±0.072, BA=0.802±0.066, Acc=0.782±0.082
  Results saved to /hy-tmp/project/data/pure63_mainline/models/mainline_formal_experiment/02_representative_model_optimization/trials/rf_nsga_best_06
  rf_nsga_best_07: G2=0.5046, All=0.7693, params={'n_estimators': 800, 'max_depth': 16, 'min_samples_leaf': 7, 'max_features': 0.1746074041599417, 'class_weight': 'balanced_subsample'}

  Task: Thiram Presence (has_thiram), classes=[0, 1], samples=901
    RF: F1=0.856±0.081, BA=0.854±0.077, Acc=0.883±0.076

  Task: MG Presence (has_mg), classes=[0, 1], samples=901
    RF: F1=0.816±0.078, BA=0.813±0.073, Acc=0.858±0.064

  Task: MBA Presence (has_mba), classes=[0, 1], samples=901
    RF: F1=0.864±0.071, BA=0.872±0.077, Acc=0.897±0.063

  Task: Thiram Positive Molar Grade (c_thiram), classes=[4, 5, 6], samples=650
    RF: F1=0.784±0.106, BA=0.832±0.082, Acc=0.781±0.110

  Task: MG Positive Molar Grade (c_mg), classes=[4, 5, 6], samples=648
    RF: F1=0.505±0.087, BA=0.534±0.115, Acc=0.595±0.151

  Task: MBA Positive Molar Grade (c_mba), classes=[4, 5, 6], samples=681
    RF: F1=0.792±0.072, BA=0.802±0.066, Acc=0.782±0.082
  Results saved to /hy-tmp/project/data/pure63_mainline/models/mainline_formal_experiment/02_representative_model_optimization/trials/rf_nsga_best_07
  rf_nsga_best_08: G2=0.5035, All=0.7701, params={'n_estimators': 600, 'max_depth': 11, 'min_samples_leaf': 5, 'max_features': 0.17462802355441434, 'class_weight': 'balanced_subsample'}

  Task: Thiram Presence (has_thiram), classes=[0, 1], samples=901
    RF: F1=0.857±0.077, BA=0.854±0.071, Acc=0.885±0.071

  Task: MG Presence (has_mg), classes=[0, 1], samples=901
    RF: F1=0.816±0.073, BA=0.811±0.068, Acc=0.859±0.060

  Task: MBA Presence (has_mba), classes=[0, 1], samples=901
    RF: F1=0.872±0.067, BA=0.880±0.076, Acc=0.903±0.059

  Task: Thiram Positive Molar Grade (c_thiram), classes=[4, 5, 6], samples=650
    RF: F1=0.787±0.110, BA=0.834±0.086, Acc=0.784±0.115

  Task: MG Positive Molar Grade (c_mg), classes=[4, 5, 6], samples=648
    RF: F1=0.503±0.088, BA=0.533±0.116, Acc=0.594±0.151

  Task: MBA Positive Molar Grade (c_mba), classes=[4, 5, 6], samples=681
    RF: F1=0.784±0.073, BA=0.795±0.069, Acc=0.774±0.085
  Results saved to /hy-tmp/project/data/pure63_mainline/models/mainline_formal_experiment/02_representative_model_optimization/trials/rf_nsga_best_08
  rf_nsga_best_09: G2=0.5046, All=0.7693, params={'n_estimators': 800, 'max_depth': 24, 'min_samples_leaf': 7, 'max_features': 0.17462802355441434, 'class_weight': 'balanced_subsample'}

  Task: Thiram Presence (has_thiram), classes=[0, 1], samples=901
    RF: F1=0.856±0.081, BA=0.854±0.077, Acc=0.883±0.076

  Task: MG Presence (has_mg), classes=[0, 1], samples=901
    RF: F1=0.816±0.078, BA=0.813±0.073, Acc=0.858±0.064

  Task: MBA Presence (has_mba), classes=[0, 1], samples=901
    RF: F1=0.864±0.071, BA=0.872±0.077, Acc=0.897±0.063

  Task: Thiram Positive Molar Grade (c_thiram), classes=[4, 5, 6], samples=650
    RF: F1=0.784±0.106, BA=0.832±0.082, Acc=0.781±0.110

  Task: MG Positive Molar Grade (c_mg), classes=[4, 5, 6], samples=648
    RF: F1=0.505±0.087, BA=0.534±0.115, Acc=0.595±0.151

  Task: MBA Positive Molar Grade (c_mba), classes=[4, 5, 6], samples=681
    RF: F1=0.792±0.072, BA=0.802±0.066, Acc=0.782±0.082
  Results saved to /hy-tmp/project/data/pure63_mainline/models/mainline_formal_experiment/02_representative_model_optimization/trials/rf_nsga_best_09
Pareto front plot saved: /hy-tmp/project/data/pure63_mainline/models/mainline_formal_experiment/02_representative_model_optimization/pareto_front_rf.png
Importance plot saved: /hy-tmp/project/data/pure63_mainline/models/mainline_formal_experiment/02_representative_model_optimization/importance_g2_rf.png

Optimization complete.
