[I 2026-05-18 16:34:06,449] A new study created in RDB with name: nsga_RF

============================================================
  NSGA-II Optimization: RF (100 trials)
============================================================
Running 100 trials for RF (already have 0)
  0%|          | 0/100 [00:00<?, ?it/s]                                         0%|          | 0/100 [01:16<?, ?it/s]  1%|          | 1/100 [01:16<2:06:21, 76.58s/it]                                                   1%|          | 1/100 [01:51<2:06:21, 76.58s/it]  2%|▏         | 2/100 [01:51<1:24:58, 52.02s/it]                                                   2%|▏         | 2/100 [03:51<1:24:58, 52.02s/it]  3%|▎         | 3/100 [03:51<2:14:13, 83.02s/it]                                                   3%|▎         | 3/100 [05:00<2:14:13, 83.02s/it]  4%|▍         | 4/100 [05:00<2:04:08, 77.59s/it]                                                   4%|▍         | 4/100 [06:29<2:04:08, 77.59s/it]  5%|▌         | 5/100 [06:29<2:09:07, 81.55s/it]                                                   5%|▌         | 5/100 [08:56<2:09:07, 81.55s/it]  6%|▌         | 6/100 [08:56<2:43:01, 104.06s/it]                                                    6%|▌         | 6/100 [09:59<2:43:01, 104.06s/it]  7%|▋         | 7/100 [09:59<2:20:17, 90.51s/it]                                                    7%|▋         | 7/100 [10:35<2:20:17, 90.51s/it]  8%|▊         | 8/100 [10:35<1:51:55, 72.99s/it]
  Task: Thiram Presence (has_thiram), classes=[0, 1], samples=901
    RF: F1=0.849±0.090, BA=0.849±0.089, Acc=0.877±0.084

  Task: MG Presence (has_mg), classes=[0, 1], samples=901
    RF: F1=0.802±0.082, BA=0.797±0.077, Acc=0.848±0.067

  Task: MBA Presence (has_mba), classes=[0, 1], samples=901
    RF: F1=0.873±0.071, BA=0.876±0.071, Acc=0.903±0.063

  Task: Thiram Positive Molar Grade (c_thiram), classes=[4, 5, 6], samples=650
    RF: F1=0.787±0.109, BA=0.833±0.083, Acc=0.784±0.114

  Task: MG Positive Molar Grade (c_mg), classes=[4, 5, 6], samples=648
    RF: F1=0.488±0.092, BA=0.521±0.119, Acc=0.585±0.153

  Task: MBA Positive Molar Grade (c_mba), classes=[4, 5, 6], samples=681
    RF: F1=0.786±0.069, BA=0.798±0.061, Acc=0.776±0.079
[I 2026-05-18 16:35:23,034] Trial 0 finished with values: [0.4884160785255845, 0.7641922814721761] and parameters: {'n_estimators': 600, 'max_depth': 34, 'min_samples_leaf': 6, 'max_features': 0.3394633936788146, 'class_weight': 'balanced'}.

  Task: Thiram Presence (has_thiram), classes=[0, 1], samples=901
    RF: F1=0.859±0.080, BA=0.860±0.077, Acc=0.884±0.077

  Task: MG Presence (has_mg), classes=[0, 1], samples=901
    RF: F1=0.802±0.065, BA=0.793±0.059, Acc=0.849±0.057

  Task: MBA Presence (has_mba), classes=[0, 1], samples=901
    RF: F1=0.875±0.070, BA=0.876±0.068, Acc=0.906±0.062

  Task: Thiram Positive Molar Grade (c_thiram), classes=[4, 5, 6], samples=650
    RF: F1=0.785±0.109, BA=0.830±0.084, Acc=0.782±0.114

  Task: MG Positive Molar Grade (c_mg), classes=[4, 5, 6], samples=648
    RF: F1=0.486±0.094, BA=0.518±0.121, Acc=0.582±0.155

  Task: MBA Positive Molar Grade (c_mba), classes=[4, 5, 6], samples=681
    RF: F1=0.776±0.071, BA=0.788±0.063, Acc=0.767±0.081
[I 2026-05-18 16:35:57,873] Trial 1 finished with values: [0.48631514249356494, 0.7638567226230163] and parameters: {'n_estimators': 200, 'max_depth': 32, 'min_samples_leaf': 5, 'max_features': 0.3832290311184182, 'class_weight': 'balanced_subsample'}.

  Task: Thiram Presence (has_thiram), classes=[0, 1], samples=901
    RF: F1=0.824±0.113, BA=0.806±0.101, Acc=0.867±0.084

  Task: MG Presence (has_mg), classes=[0, 1], samples=901
    RF: F1=0.797±0.057, BA=0.781±0.054, Acc=0.851±0.045

  Task: MBA Presence (has_mba), classes=[0, 1], samples=901
    RF: F1=0.865±0.071, BA=0.870±0.076, Acc=0.898±0.063

  Task: Thiram Positive Molar Grade (c_thiram), classes=[4, 5, 6], samples=650
    RF: F1=0.793±0.114, BA=0.841±0.086, Acc=0.790±0.120

  Task: MG Positive Molar Grade (c_mg), classes=[4, 5, 6], samples=648
    RF: F1=0.485±0.098, BA=0.514±0.126, Acc=0.578±0.154

  Task: MBA Positive Molar Grade (c_mba), classes=[4, 5, 6], samples=681
    RF: F1=0.785±0.081, BA=0.795±0.077, Acc=0.773±0.095
[I 2026-05-18 16:37:57,784] Trial 2 finished with values: [0.4848875711359322, 0.75804765303754] and parameters: {'n_estimators': 1100, 'max_depth': 13, 'min_samples_leaf': 2, 'max_features': 0.17336180394137352, 'class_weight': 'balanced_subsample'}.

  Task: Thiram Presence (has_thiram), classes=[0, 1], samples=901
    RF: F1=0.849±0.086, BA=0.845±0.073, Acc=0.877±0.079

  Task: MG Presence (has_mg), classes=[0, 1], samples=901
    RF: F1=0.817±0.072, BA=0.812±0.067, Acc=0.860±0.058

  Task: MBA Presence (has_mba), classes=[0, 1], samples=901
    RF: F1=0.871±0.064, BA=0.878±0.072, Acc=0.902±0.057

  Task: Thiram Positive Molar Grade (c_thiram), classes=[4, 5, 6], samples=650
    RF: F1=0.789±0.110, BA=0.838±0.084, Acc=0.786±0.115

  Task: MG Positive Molar Grade (c_mg), classes=[4, 5, 6], samples=648
    RF: F1=0.498±0.091, BA=0.526±0.118, Acc=0.590±0.151

  Task: MBA Positive Molar Grade (c_mba), classes=[4, 5, 6], samples=681
    RF: F1=0.789±0.076, BA=0.798±0.073, Acc=0.777±0.089
[I 2026-05-18 16:39:07,050] Trial 3 finished with values: [0.49784468947564714, 0.7688092893834414] and parameters: {'n_estimators': 600, 'max_depth': 16, 'min_samples_leaf': 5, 'max_features': 0.15579754426081674, 'class_weight': 'balanced_subsample'}.

  Task: Thiram Presence (has_thiram), classes=[0, 1], samples=901
    RF: F1=0.822±0.117, BA=0.805±0.105, Acc=0.864±0.093

  Task: MG Presence (has_mg), classes=[0, 1], samples=901
    RF: F1=0.796±0.060, BA=0.780±0.057, Acc=0.850±0.047

  Task: MBA Presence (has_mba), classes=[0, 1], samples=901
    RF: F1=0.875±0.067, BA=0.876±0.070, Acc=0.906±0.059

  Task: Thiram Positive Molar Grade (c_thiram), classes=[4, 5, 6], samples=650
    RF: F1=0.794±0.116, BA=0.841±0.086, Acc=0.790±0.122

  Task: MG Positive Molar Grade (c_mg), classes=[4, 5, 6], samples=648
    RF: F1=0.480±0.093, BA=0.510±0.121, Acc=0.569±0.143

  Task: MBA Positive Molar Grade (c_mba), classes=[4, 5, 6], samples=681
    RF: F1=0.782±0.073, BA=0.793±0.067, Acc=0.773±0.086
[I 2026-05-18 16:40:35,619] Trial 4 finished with values: [0.48007491917223266, 0.7579958653746864] and parameters: {'n_estimators': 700, 'max_depth': 29, 'min_samples_leaf': 2, 'max_features': 0.3056937753654446, 'class_weight': 'balanced'}.

  Task: Thiram Presence (has_thiram), classes=[0, 1], samples=901
    RF: F1=0.809±0.124, BA=0.791±0.112, Acc=0.856±0.095

  Task: MG Presence (has_mg), classes=[0, 1], samples=901
    RF: F1=0.793±0.060, BA=0.774±0.057, Acc=0.851±0.044

  Task: MBA Presence (has_mba), classes=[0, 1], samples=901
    RF: F1=0.877±0.070, BA=0.875±0.071, Acc=0.908±0.060

  Task: Thiram Positive Molar Grade (c_thiram), classes=[4, 5, 6], samples=650
    RF: F1=0.786±0.113, BA=0.834±0.085, Acc=0.782±0.120

  Task: MG Positive Molar Grade (c_mg), classes=[4, 5, 6], samples=648
    RF: F1=0.479±0.093, BA=0.511±0.122, Acc=0.566±0.142

  Task: MBA Positive Molar Grade (c_mba), classes=[4, 5, 6], samples=681
    RF: F1=0.777±0.066, BA=0.788±0.061, Acc=0.766±0.080
[I 2026-05-18 16:43:03,381] Trial 5 finished with values: [0.4794020170764929, 0.753497288462959] and parameters: {'n_estimators': 800, 'max_depth': 12, 'min_samples_leaf': 1, 'max_features': 0.4795542149013333, 'class_weight': 'balanced'}.

  Task: Thiram Presence (has_thiram), classes=[0, 1], samples=901
    RF: F1=0.851±0.085, BA=0.850±0.084, Acc=0.879±0.080

  Task: MG Presence (has_mg), classes=[0, 1], samples=901
    RF: F1=0.807±0.078, BA=0.802±0.071, Acc=0.851±0.065

  Task: MBA Presence (has_mba), classes=[0, 1], samples=901
    RF: F1=0.868±0.076, BA=0.873±0.079, Acc=0.900±0.066

  Task: Thiram Positive Molar Grade (c_thiram), classes=[4, 5, 6], samples=650
    RF: F1=0.790±0.106, BA=0.835±0.081, Acc=0.787±0.111

  Task: MG Positive Molar Grade (c_mg), classes=[4, 5, 6], samples=648
    RF: F1=0.492±0.088, BA=0.522±0.115, Acc=0.584±0.152

  Task: MBA Positive Molar Grade (c_mba), classes=[4, 5, 6], samples=681
    RF: F1=0.790±0.068, BA=0.803±0.060, Acc=0.782±0.077
[I 2026-05-18 16:44:05,978] Trial 6 finished with values: [0.49173918134509087, 0.7662996154799312] and parameters: {'n_estimators': 500, 'max_depth': 10, 'min_samples_leaf': 6, 'max_features': 0.27606099749584057, 'class_weight': 'balanced_subsample'}.

  Task: Thiram Presence (has_thiram), classes=[0, 1], samples=901
    RF: F1=0.849±0.090, BA=0.839±0.073, Acc=0.879±0.078

  Task: MG Presence (has_mg), classes=[0, 1], samples=901
    RF: F1=0.811±0.064, BA=0.799±0.061, Acc=0.860±0.051

  Task: MBA Presence (has_mba), classes=[0, 1], samples=901
    RF: F1=0.876±0.073, BA=0.876±0.073, Acc=0.907±0.063

  Task: Thiram Positive Molar Grade (c_thiram), classes=[4, 5, 6], samples=650
    RF: F1=0.790±0.111, BA=0.837±0.083, Acc=0.785±0.117

  Task: MG Positive Molar Grade (c_mg), classes=[4, 5, 6], samples=648
    RF: F1=0.487±0.093, BA=0.518±0.121, Acc=0.579±0.150

  Task: MBA Positive Molar Grade (c_mba), classes=[4, 5, 6], samples=681
    RF: F1=0.788±0.077, BA=0.800±0.069, Acc=0.778±0.088
[I 2026-05-18 16:44:41,466] Trial 7 finished with values: [0.4867166395255528, 0.7667401265627968] and parameters: {'n_estimators': 200, 'max_depth': 33, 'min_samples_leaf': 3, 'max_features': 0.36500891374159283, 'class_weight': 'balanced_subsample'}.

  Task: Thiram Presence (has_thiram), classes=[0, 1], samples=901                                                   8%|▊         | 8/100 [12:30<1:51:55, 72.99s/it]  9%|▉         | 9/100 [12:30<2:11:03, 86.41s/it]                                                   9%|▉         | 9/100 [13:59<2:11:03, 86.41s/it] 10%|█         | 10/100 [13:59<2:10:47, 87.20s/it]                                                   10%|█         | 10/100 [15:09<2:10:47, 87.20s/it] 11%|█         | 11/100 [15:09<2:01:16, 81.76s/it]                                                   11%|█         | 11/100 [16:12<2:01:16, 81.76s/it] 12%|█▏        | 12/100 [16:12<1:51:34, 76.08s/it]                                                   12%|█▏        | 12/100 [16:45<1:51:34, 76.08s/it] 13%|█▎        | 13/100 [16:45<1:31:25, 63.06s/it]                                                   13%|█▎        | 13/100 [17:53<1:31:25, 63.06s/it] 14%|█▍        | 14/100 [17:53<1:32:27, 64.50s/it]                                                   14%|█▍        | 14/100 [19:02<1:32:27, 64.50s/it] 15%|█▌        | 15/100 [19:02<1:33:33, 66.04s/it]                                                   15%|█▌        | 15/100 [19:43<1:33:33, 66.04s/it] 16%|█▌        | 16/100 [19:43<1:21:31, 58.23s/it]
    RF: F1=0.854±0.081, BA=0.854±0.078, Acc=0.879±0.079

  Task: MG Presence (has_mg), classes=[0, 1], samples=901
    RF: F1=0.803±0.085, BA=0.801±0.079, Acc=0.847±0.072

  Task: MBA Presence (has_mba), classes=[0, 1], samples=901
    RF: F1=0.876±0.067, BA=0.877±0.066, Acc=0.906±0.060

  Task: Thiram Positive Molar Grade (c_thiram), classes=[4, 5, 6], samples=650
    RF: F1=0.782±0.109, BA=0.827±0.086, Acc=0.780±0.114

  Task: MG Positive Molar Grade (c_mg), classes=[4, 5, 6], samples=648
    RF: F1=0.485±0.087, BA=0.517±0.114, Acc=0.579±0.152

  Task: MBA Positive Molar Grade (c_mba), classes=[4, 5, 6], samples=681
    RF: F1=0.783±0.070, BA=0.796±0.061, Acc=0.775±0.078
[I 2026-05-18 16:46:37,387] Trial 8 finished with values: [0.48522092100110614, 0.7638676189280679] and parameters: {'n_estimators': 800, 'max_depth': 13, 'min_samples_leaf': 8, 'max_features': 0.4100531293444458, 'class_weight': 'balanced'}.

  Task: Thiram Presence (has_thiram), classes=[0, 1], samples=901
    RF: F1=0.817±0.110, BA=0.797±0.098, Acc=0.864±0.080

  Task: MG Presence (has_mg), classes=[0, 1], samples=901
    RF: F1=0.791±0.056, BA=0.773±0.053, Acc=0.848±0.049

  Task: MBA Presence (has_mba), classes=[0, 1], samples=901
    RF: F1=0.860±0.084, BA=0.865±0.088, Acc=0.896±0.070

  Task: Thiram Positive Molar Grade (c_thiram), classes=[4, 5, 6], samples=650
    RF: F1=0.791±0.114, BA=0.839±0.087, Acc=0.788±0.120

  Task: MG Positive Molar Grade (c_mg), classes=[4, 5, 6], samples=648
    RF: F1=0.480±0.097, BA=0.511±0.127, Acc=0.570±0.149

  Task: MBA Positive Molar Grade (c_mba), classes=[4, 5, 6], samples=681
    RF: F1=0.782±0.077, BA=0.792±0.073, Acc=0.771±0.091
[I 2026-05-18 16:48:06,341] Trial 9 finished with values: [0.4800725909885507, 0.7533969269514739] and parameters: {'n_estimators': 800, 'max_depth': 33, 'min_samples_leaf': 1, 'max_features': 0.1783931449676581, 'class_weight': 'balanced_subsample'}.

  Task: Thiram Presence (has_thiram), classes=[0, 1], samples=901
    RF: F1=0.856±0.088, BA=0.854±0.084, Acc=0.883±0.081

  Task: MG Presence (has_mg), classes=[0, 1], samples=901
    RF: F1=0.811±0.084, BA=0.807±0.079, Acc=0.855±0.067

  Task: MBA Presence (has_mba), classes=[0, 1], samples=901
    RF: F1=0.870±0.071, BA=0.875±0.073, Acc=0.901±0.063

  Task: Thiram Positive Molar Grade (c_thiram), classes=[4, 5, 6], samples=650
    RF: F1=0.787±0.109, BA=0.833±0.083, Acc=0.784±0.114

  Task: MG Positive Molar Grade (c_mg), classes=[4, 5, 6], samples=648
    RF: F1=0.498±0.090, BA=0.527±0.117, Acc=0.589±0.153

  Task: MBA Positive Molar Grade (c_mba), classes=[4, 5, 6], samples=681
    RF: F1=0.795±0.071, BA=0.808±0.062, Acc=0.787±0.080
[I 2026-05-18 16:49:15,773] Trial 10 finished with values: [0.4981265283894721, 0.7694543033134117] and parameters: {'n_estimators': 600, 'max_depth': 15, 'min_samples_leaf': 7, 'max_features': 0.2427013306774357, 'class_weight': 'balanced_subsample'}.

  Task: Thiram Presence (has_thiram), classes=[0, 1], samples=901
    RF: F1=0.804±0.123, BA=0.785±0.110, Acc=0.851±0.096

  Task: MG Presence (has_mg), classes=[0, 1], samples=901
    RF: F1=0.790±0.062, BA=0.769±0.060, Acc=0.850±0.053

  Task: MBA Presence (has_mba), classes=[0, 1], samples=901
    RF: F1=0.892±0.075, BA=0.893±0.075, Acc=0.919±0.064

  Task: Thiram Positive Molar Grade (c_thiram), classes=[4, 5, 6], samples=650
    RF: F1=0.787±0.110, BA=0.835±0.083, Acc=0.784±0.116

  Task: MG Positive Molar Grade (c_mg), classes=[4, 5, 6], samples=648
    RF: F1=0.477±0.091, BA=0.507±0.119, Acc=0.561±0.139

  Task: MBA Positive Molar Grade (c_mba), classes=[4, 5, 6], samples=681
    RF: F1=0.777±0.068, BA=0.788±0.062, Acc=0.766±0.082
[I 2026-05-18 16:50:18,849] Trial 11 finished with values: [0.4767881899339175, 0.7544911131203978] and parameters: {'n_estimators': 300, 'max_depth': 30, 'min_samples_leaf': 1, 'max_features': 0.4947547746402069, 'class_weight': 'balanced'}.

  Task: Thiram Presence (has_thiram), classes=[0, 1], samples=901
    RF: F1=0.862±0.072, BA=0.862±0.070, Acc=0.887±0.069

  Task: MG Presence (has_mg), classes=[0, 1], samples=901
    RF: F1=0.811±0.083, BA=0.808±0.080, Acc=0.854±0.069

  Task: MBA Presence (has_mba), classes=[0, 1], samples=901
    RF: F1=0.878±0.067, BA=0.878±0.068, Acc=0.908±0.060

  Task: Thiram Positive Molar Grade (c_thiram), classes=[4, 5, 6], samples=650
    RF: F1=0.780±0.108, BA=0.826±0.086, Acc=0.779±0.113

  Task: MG Positive Molar Grade (c_mg), classes=[4, 5, 6], samples=648
    RF: F1=0.480±0.093, BA=0.511±0.121, Acc=0.573±0.157

  Task: MBA Positive Molar Grade (c_mba), classes=[4, 5, 6], samples=681
    RF: F1=0.784±0.068, BA=0.797±0.058, Acc=0.776±0.076
[I 2026-05-18 16:50:51,943] Trial 12 finished with values: [0.4799521641563901, 0.7658196105911679] and parameters: {'n_estimators': 200, 'max_depth': 30, 'min_samples_leaf': 6, 'max_features': 0.3916028672163949, 'class_weight': 'balanced'}.

  Task: Thiram Presence (has_thiram), classes=[0, 1], samples=901
    RF: F1=0.853±0.078, BA=0.855±0.074, Acc=0.879±0.075

  Task: MG Presence (has_mg), classes=[0, 1], samples=901
    RF: F1=0.804±0.078, BA=0.798±0.073, Acc=0.849±0.065

  Task: MBA Presence (has_mba), classes=[0, 1], samples=901
    RF: F1=0.873±0.071, BA=0.876±0.071, Acc=0.903±0.063

  Task: Thiram Positive Molar Grade (c_thiram), classes=[4, 5, 6], samples=650
    RF: F1=0.783±0.109, BA=0.828±0.085, Acc=0.780±0.114

  Task: MG Positive Molar Grade (c_mg), classes=[4, 5, 6], samples=648
    RF: F1=0.489±0.094, BA=0.520±0.122, Acc=0.585±0.155

  Task: MBA Positive Molar Grade (c_mba), classes=[4, 5, 6], samples=681
    RF: F1=0.787±0.072, BA=0.800±0.064, Acc=0.778±0.082
[I 2026-05-18 16:51:59,794] Trial 13 finished with values: [0.4885518895186049, 0.7647332530593748] and parameters: {'n_estimators': 500, 'max_depth': 11, 'min_samples_leaf': 7, 'max_features': 0.3493192507310232, 'class_weight': 'balanced'}.

  Task: Thiram Presence (has_thiram), classes=[0, 1], samples=901
    RF: F1=0.855±0.091, BA=0.855±0.090, Acc=0.880±0.087

  Task: MG Presence (has_mg), classes=[0, 1], samples=901
    RF: F1=0.797±0.079, BA=0.790±0.073, Acc=0.846±0.062

  Task: MBA Presence (has_mba), classes=[0, 1], samples=901
    RF: F1=0.875±0.069, BA=0.877±0.068, Acc=0.905±0.062

  Task: Thiram Positive Molar Grade (c_thiram), classes=[4, 5, 6], samples=650
    RF: F1=0.783±0.108, BA=0.828±0.085, Acc=0.780±0.114

  Task: MG Positive Molar Grade (c_mg), classes=[4, 5, 6], samples=648
    RF: F1=0.491±0.094, BA=0.524±0.121, Acc=0.587±0.155

  Task: MBA Positive Molar Grade (c_mba), classes=[4, 5, 6], samples=681
    RF: F1=0.789±0.069, BA=0.801±0.061, Acc=0.779±0.079
[I 2026-05-18 16:53:09,388] Trial 14 finished with values: [0.4908651009569535, 0.7648447221642928] and parameters: {'n_estimators': 500, 'max_depth': 17, 'min_samples_leaf': 6, 'max_features': 0.35502298854208525, 'class_weight': 'balanced'}.

  Task: Thiram Presence (has_thiram), classes=[0, 1], samples=901
    RF: F1=0.856±0.081, BA=0.854±0.076, Acc=0.883±0.077

  Task: MG Presence (has_mg), classes=[0, 1], samples=901
    RF: F1=0.802±0.087, BA=0.798±0.084, Acc=0.847±0.073

  Task: MBA Presence (has_mba), classes=[0, 1], samples=901
    RF: F1=0.870±0.071, BA=0.874±0.070, Acc=0.901±0.063

  Task: Thiram Positive Molar Grade (c_thiram), classes=[4, 5, 6], samples=650
    RF: F1=0.780±0.109, BA=0.827±0.087, Acc=0.778±0.112

  Task: MG Positive Molar Grade (c_mg), classes=[4, 5, 6], samples=648
    RF: F1=0.485±0.089, BA=0.517±0.116, Acc=0.580±0.153

  Task: MBA Positive Molar Grade (c_mba), classes=[4, 5, 6], samples=681
    RF: F1=0.794±0.073, BA=0.806±0.066, Acc=0.785±0.083
[I 2026-05-18 16:53:49,476] Trial 15 finished with values: [0.4853329598413826, 0.7645519876928332] and parameters: {'n_estimators': 300, 'max_depth': 27, 'min_samples_leaf': 7, 'max_features': 0.3245108790277985, 'class_weight': 'balanced'}.

  Task: Thiram Presence (has_thiram), classes=[0, 1], samples=901
    RF: F1=0.822±0.113, BA=0.803±0.100, Acc=0.867±0.081

  Task: MG Presence (has_mg), classes=[0, 1], samples=901                                                   16%|█▌        | 16/100 [21:02<1:21:31, 58.23s/it] 17%|█▋        | 17/100 [21:02<1:29:26, 64.66s/it]                                                   17%|█▋        | 17/100 [21:59<1:29:26, 64.66s/it] 18%|█▊        | 18/100 [21:59<1:25:08, 62.30s/it]                                                   18%|█▊        | 18/100 [22:36<1:25:08, 62.30s/it] 19%|█▉        | 19/100 [22:36<1:14:00, 54.82s/it]                                                   19%|█▉        | 19/100 [23:46<1:14:00, 54.82s/it] 20%|██        | 20/100 [23:46<1:18:54, 59.18s/it]                                                   20%|██        | 20/100 [25:48<1:18:54, 59.18s/it] 21%|██        | 21/100 [25:48<1:42:49, 78.09s/it]                                                   21%|██        | 21/100 [27:07<1:42:49, 78.09s/it] 22%|██▏       | 22/100 [27:07<1:42:03, 78.51s/it]                                                   22%|██▏       | 22/100 [28:52<1:42:03, 78.51s/it] 23%|██▎       | 23/100 [28:52<1:50:58, 86.48s/it]                                                   23%|██▎       | 23/100 [29:28<1:50:58, 86.48s/it] 24%|██▍       | 24/100 [29:28<1:30:16, 71.28s/it]
    RF: F1=0.789±0.059, BA=0.773±0.055, Acc=0.846±0.048

  Task: MBA Presence (has_mba), classes=[0, 1], samples=901
    RF: F1=0.862±0.092, BA=0.869±0.094, Acc=0.898±0.074

  Task: Thiram Positive Molar Grade (c_thiram), classes=[4, 5, 6], samples=650
    RF: F1=0.797±0.114, BA=0.846±0.085, Acc=0.792±0.119

  Task: MG Positive Molar Grade (c_mg), classes=[4, 5, 6], samples=648
    RF: F1=0.482±0.094, BA=0.511±0.122, Acc=0.572±0.147

  Task: MBA Positive Molar Grade (c_mba), classes=[4, 5, 6], samples=681
    RF: F1=0.771±0.094, BA=0.778±0.096, Acc=0.761±0.107
[I 2026-05-18 16:55:09,091] Trial 16 finished with values: [0.482162874108119, 0.7537509659638499] and parameters: {'n_estimators': 700, 'max_depth': 19, 'min_samples_leaf': 1, 'max_features': 0.1431565707973218, 'class_weight': 'balanced_subsample'}.

  Task: Thiram Presence (has_thiram), classes=[0, 1], samples=901
    RF: F1=0.846±0.097, BA=0.844±0.094, Acc=0.875±0.089

  Task: MG Presence (has_mg), classes=[0, 1], samples=901
    RF: F1=0.811±0.082, BA=0.808±0.078, Acc=0.854±0.068

  Task: MBA Presence (has_mba), classes=[0, 1], samples=901
    RF: F1=0.869±0.069, BA=0.875±0.075, Acc=0.900±0.062

  Task: Thiram Positive Molar Grade (c_thiram), classes=[4, 5, 6], samples=650
    RF: F1=0.786±0.106, BA=0.833±0.082, Acc=0.783±0.110

  Task: MG Positive Molar Grade (c_mg), classes=[4, 5, 6], samples=648
    RF: F1=0.499±0.088, BA=0.528±0.116, Acc=0.589±0.151

  Task: MBA Positive Molar Grade (c_mba), classes=[4, 5, 6], samples=681
    RF: F1=0.793±0.068, BA=0.804±0.061, Acc=0.783±0.078
