[I 2026-05-18 17:45:35,879] Trial 55 finished with values: [0.4981265283894721, 0.7688508023001236] and parameters: {'n_estimators': 500, 'max_depth': 22, 'min_samples_leaf': 8, 'max_features': 0.2427013306774357, 'class_weight': 'balanced_subsample'}.

  Task: Thiram Presence (has_thiram), classes=[0, 1], samples=901
    RF: F1=0.824±0.105, BA=0.806±0.092, Acc=0.866±0.082

  Task: MG Presence (has_mg), classes=[0, 1], samples=901
    RF: F1=0.796±0.057, BA=0.781±0.054, Acc=0.851±0.044

  Task: MBA Presence (has_mba), classes=[0, 1], samples=901
    RF: F1=0.873±0.066, BA=0.874±0.068, Acc=0.905±0.059

  Task: Thiram Positive Molar Grade (c_thiram), classes=[4, 5, 6], samples=650
    RF: F1=0.793±0.114, BA=0.840±0.087, Acc=0.790±0.120

  Task: MG Positive Molar Grade (c_mg), classes=[4, 5, 6], samples=648
    RF: F1=0.481±0.093, BA=0.513±0.122, Acc=0.569±0.145                                                   56%|█████▌    | 56/100 [1:13:27<59:37, 81.30s/it] 57%|█████▋    | 57/100 [1:13:27<1:06:10, 92.33s/it]                                                     57%|█████▋    | 57/100 [1:14:37<1:06:10, 92.33s/it] 58%|█████▊    | 58/100 [1:14:37<59:59, 85.70s/it]                                                     58%|█████▊    | 58/100 [1:15:45<59:59, 85.70s/it] 59%|█████▉    | 59/100 [1:15:45<54:57, 80.44s/it]                                                   59%|█████▉    | 59/100 [1:16:53<54:57, 80.44s/it] 60%|██████    | 60/100 [1:16:53<51:06, 76.65s/it]                                                   60%|██████    | 60/100 [1:18:21<51:06, 76.65s/it] 61%|██████    | 61/100 [1:18:21<52:00, 80.02s/it]                                                   61%|██████    | 61/100 [1:19:29<52:00, 80.02s/it] 62%|██████▏   | 62/100 [1:19:29<48:20, 76.32s/it]                                                   62%|██████▏   | 62/100 [1:20:58<48:20, 76.32s/it] 63%|██████▎   | 63/100 [1:20:58<49:24, 80.12s/it]                                                   63%|██████▎   | 63/100 [1:22:28<49:24, 80.12s/it] 64%|██████▍   | 64/100 [1:22:28<49:52, 83.11s/it]

  Task: MBA Positive Molar Grade (c_mba), classes=[4, 5, 6], samples=681
    RF: F1=0.781±0.078, BA=0.792±0.073, Acc=0.770±0.092
[I 2026-05-18 17:47:33,924] Trial 56 finished with values: [0.4813670201817571, 0.7581373147609157] and parameters: {'n_estimators': 1000, 'max_depth': 15, 'min_samples_leaf': 2, 'max_features': 0.2427013306774357, 'class_weight': 'balanced_subsample'}.

  Task: Thiram Presence (has_thiram), classes=[0, 1], samples=901
    RF: F1=0.852±0.092, BA=0.850±0.090, Acc=0.880±0.085

  Task: MG Presence (has_mg), classes=[0, 1], samples=901
    RF: F1=0.809±0.078, BA=0.804±0.073, Acc=0.853±0.064

  Task: MBA Presence (has_mba), classes=[0, 1], samples=901
    RF: F1=0.868±0.073, BA=0.873±0.073, Acc=0.900±0.065

  Task: Thiram Positive Molar Grade (c_thiram), classes=[4, 5, 6], samples=650
    RF: F1=0.792±0.106, BA=0.839±0.079, Acc=0.788±0.112

  Task: MG Positive Molar Grade (c_mg), classes=[4, 5, 6], samples=648
    RF: F1=0.497±0.090, BA=0.526±0.118, Acc=0.588±0.153

  Task: MBA Positive Molar Grade (c_mba), classes=[4, 5, 6], samples=681
    RF: F1=0.791±0.074, BA=0.805±0.066, Acc=0.783±0.083
[I 2026-05-18 17:48:44,170] Trial 57 finished with values: [0.4971139577332133, 0.7684116664601547] and parameters: {'n_estimators': 600, 'max_depth': 15, 'min_samples_leaf': 6, 'max_features': 0.2427013306774357, 'class_weight': 'balanced_subsample'}.

  Task: Thiram Presence (has_thiram), classes=[0, 1], samples=901
    RF: F1=0.849±0.086, BA=0.845±0.073, Acc=0.877±0.079

  Task: MG Presence (has_mg), classes=[0, 1], samples=901
    RF: F1=0.817±0.072, BA=0.812±0.067, Acc=0.860±0.058

  Task: MBA Presence (has_mba), classes=[0, 1], samples=901
    RF: F1=0.871±0.064, BA=0.878±0.072, Acc=0.902±0.057

  Task: Thiram Positive Molar Grade (c_thiram), classes=[4, 5, 6], samples=650
    RF: F1=0.789±0.110, BA=0.838±0.084, Acc=0.786±0.115

  Task: MG Positive Molar Grade (c_mg), classes=[4, 5, 6], samples=648
    RF: F1=0.498±0.091, BA=0.526±0.118, Acc=0.590±0.151

  Task: MBA Positive Molar Grade (c_mba), classes=[4, 5, 6], samples=681
    RF: F1=0.789±0.076, BA=0.798±0.073, Acc=0.777±0.089
[I 2026-05-18 17:49:52,319] Trial 58 finished with values: [0.49784468947564714, 0.7688092893834414] and parameters: {'n_estimators': 600, 'max_depth': 16, 'min_samples_leaf': 5, 'max_features': 0.15579754426081674, 'class_weight': 'balanced_subsample'}.

  Task: Thiram Presence (has_thiram), classes=[0, 1], samples=901
    RF: F1=0.856±0.077, BA=0.850±0.066, Acc=0.884±0.071

  Task: MG Presence (has_mg), classes=[0, 1], samples=901
    RF: F1=0.815±0.068, BA=0.805±0.063, Acc=0.861±0.053

  Task: MBA Presence (has_mba), classes=[0, 1], samples=901
    RF: F1=0.869±0.065, BA=0.875±0.071, Acc=0.901±0.058

  Task: Thiram Positive Molar Grade (c_thiram), classes=[4, 5, 6], samples=650
    RF: F1=0.790±0.112, BA=0.837±0.085, Acc=0.786±0.117

  Task: MG Positive Molar Grade (c_mg), classes=[4, 5, 6], samples=648
    RF: F1=0.499±0.090, BA=0.528±0.118, Acc=0.590±0.152

  Task: MBA Positive Molar Grade (c_mba), classes=[4, 5, 6], samples=681
    RF: F1=0.786±0.078, BA=0.796±0.074, Acc=0.774±0.091
[I 2026-05-18 17:51:00,135] Trial 59 finished with values: [0.49917018456040657, 0.7690893853024748] and parameters: {'n_estimators': 600, 'max_depth': 15, 'min_samples_leaf': 4, 'max_features': 0.15579754426081674, 'class_weight': 'balanced_subsample'}.

  Task: Thiram Presence (has_thiram), classes=[0, 1], samples=901
    RF: F1=0.842±0.081, BA=0.829±0.066, Acc=0.876±0.071

  Task: MG Presence (has_mg), classes=[0, 1], samples=901
    RF: F1=0.813±0.070, BA=0.804±0.066, Acc=0.859±0.056

  Task: MBA Presence (has_mba), classes=[0, 1], samples=901
    RF: F1=0.868±0.070, BA=0.874±0.075, Acc=0.900±0.062

  Task: Thiram Positive Molar Grade (c_thiram), classes=[4, 5, 6], samples=650
    RF: F1=0.790±0.110, BA=0.838±0.084, Acc=0.786±0.115

  Task: MG Positive Molar Grade (c_mg), classes=[4, 5, 6], samples=648
    RF: F1=0.498±0.090, BA=0.529±0.119, Acc=0.591±0.152

  Task: MBA Positive Molar Grade (c_mba), classes=[4, 5, 6], samples=681
    RF: F1=0.786±0.074, BA=0.796±0.071, Acc=0.775±0.086
[I 2026-05-18 17:52:28,018] Trial 60 finished with values: [0.49837348390125025, 0.766176300554385] and parameters: {'n_estimators': 800, 'max_depth': 15, 'min_samples_leaf': 4, 'max_features': 0.17462802355441434, 'class_weight': 'balanced_subsample'}.

  Task: Thiram Presence (has_thiram), classes=[0, 1], samples=901
    RF: F1=0.856±0.082, BA=0.853±0.076, Acc=0.883±0.077

  Task: MG Presence (has_mg), classes=[0, 1], samples=901
    RF: F1=0.808±0.076, BA=0.801±0.072, Acc=0.853±0.063

  Task: MBA Presence (has_mba), classes=[0, 1], samples=901
    RF: F1=0.869±0.070, BA=0.877±0.074, Acc=0.900±0.063

  Task: Thiram Positive Molar Grade (c_thiram), classes=[4, 5, 6], samples=650
    RF: F1=0.793±0.110, BA=0.840±0.083, Acc=0.790±0.116

  Task: MG Positive Molar Grade (c_mg), classes=[4, 5, 6], samples=648
    RF: F1=0.500±0.088, BA=0.529±0.115, Acc=0.591±0.150

  Task: MBA Positive Molar Grade (c_mba), classes=[4, 5, 6], samples=681
    RF: F1=0.789±0.071, BA=0.801±0.065, Acc=0.778±0.083
[I 2026-05-18 17:53:35,699] Trial 61 finished with values: [0.5000245447305721, 0.7692495508603603] and parameters: {'n_estimators': 600, 'max_depth': 16, 'min_samples_leaf': 5, 'max_features': 0.20071291833014568, 'class_weight': 'balanced_subsample'}.

  Task: Thiram Presence (has_thiram), classes=[0, 1], samples=901
    RF: F1=0.852±0.085, BA=0.848±0.077, Acc=0.880±0.079

  Task: MG Presence (has_mg), classes=[0, 1], samples=901
    RF: F1=0.816±0.069, BA=0.810±0.064, Acc=0.859±0.056

  Task: MBA Presence (has_mba), classes=[0, 1], samples=901
    RF: F1=0.871±0.068, BA=0.879±0.076, Acc=0.902±0.060

  Task: Thiram Positive Molar Grade (c_thiram), classes=[4, 5, 6], samples=650
    RF: F1=0.788±0.108, BA=0.837±0.082, Acc=0.785±0.113

  Task: MG Positive Molar Grade (c_mg), classes=[4, 5, 6], samples=648
    RF: F1=0.499±0.091, BA=0.527±0.118, Acc=0.591±0.150

  Task: MBA Positive Molar Grade (c_mba), classes=[4, 5, 6], samples=681
    RF: F1=0.788±0.075, BA=0.798±0.071, Acc=0.776±0.087
[I 2026-05-18 17:55:04,688] Trial 62 finished with values: [0.498869551913261, 0.7690707185772255] and parameters: {'n_estimators': 800, 'max_depth': 16, 'min_samples_leaf': 5, 'max_features': 0.15579754426081674, 'class_weight': 'balanced_subsample'}.

  Task: Thiram Presence (has_thiram), classes=[0, 1], samples=901
    RF: F1=0.854±0.081, BA=0.853±0.072, Acc=0.880±0.078

  Task: MG Presence (has_mg), classes=[0, 1], samples=901
    RF: F1=0.819±0.084, BA=0.819±0.081, Acc=0.859±0.069

  Task: MBA Presence (has_mba), classes=[0, 1], samples=901
    RF: F1=0.869±0.066, BA=0.877±0.071, Acc=0.900±0.061

  Task: Thiram Positive Molar Grade (c_thiram), classes=[4, 5, 6], samples=650
    RF: F1=0.782±0.108, BA=0.830±0.085, Acc=0.780±0.112

  Task: MG Positive Molar Grade (c_mg), classes=[4, 5, 6], samples=648
    RF: F1=0.500±0.092, BA=0.528±0.120, Acc=0.593±0.151

  Task: MBA Positive Molar Grade (c_mba), classes=[4, 5, 6], samples=681
    RF: F1=0.794±0.071, BA=0.805±0.064, Acc=0.784±0.082
[I 2026-05-18 17:56:34,791] Trial 63 finished with values: [0.5000904372952915, 0.7697860148670589] and parameters: {'n_estimators': 800, 'max_depth': 16, 'min_samples_leaf': 8, 'max_features': 0.15795794883648925, 'class_weight': 'balanced_subsample'}.

  Task: Thiram Presence (has_thiram), classes=[0, 1], samples=901
    RF: F1=0.850±0.093, BA=0.848±0.089, Acc=0.878±0.085

  Task: MG Presence (has_mg), classes=[0, 1], samples=901
    RF: F1=0.812±0.079, BA=0.808±0.074, Acc=0.855±0.067

  Task: MBA Presence (has_mba), classes=[0, 1], samples=901
    RF: F1=0.872±0.068, BA=0.879±0.075, Acc=0.903±0.060

  Task: Thiram Positive Molar Grade (c_thiram), classes=[4, 5, 6], samples=650
    RF: F1=0.788±0.108, BA=0.833±0.083, Acc=0.785±0.113

  Task: MG Positive Molar Grade (c_mg), classes=[4, 5, 6], samples=648
    RF: F1=0.501±0.087, BA=0.530±0.114, Acc=0.592±0.150

  Task: MBA Positive Molar Grade (c_mba), classes=[4, 5, 6], samples=681                                                   64%|██████▍   | 64/100 [1:23:46<49:52, 83.11s/it] 65%|██████▌   | 65/100 [1:23:46<47:35, 81.59s/it]                                                   65%|██████▌   | 65/100 [1:24:06<47:35, 81.59s/it] 66%|██████▌   | 66/100 [1:24:06<35:46, 63.13s/it]                                                   66%|██████▌   | 66/100 [1:26:07<35:46, 63.13s/it] 67%|██████▋   | 67/100 [1:26:07<44:12, 80.37s/it]                                                   67%|██████▋   | 67/100 [1:27:14<44:12, 80.37s/it] 68%|██████▊   | 68/100 [1:27:14<40:45, 76.43s/it]                                                   68%|██████▊   | 68/100 [1:28:42<40:45, 76.43s/it] 69%|██████▉   | 69/100 [1:28:42<41:20, 80.01s/it]                                                   69%|██████▉   | 69/100 [1:30:10<41:20, 80.01s/it] 70%|███████   | 70/100 [1:30:10<41:12, 82.40s/it]                                                   70%|███████   | 70/100 [1:31:27<41:12, 82.40s/it] 71%|███████   | 71/100 [1:31:27<39:06, 80.90s/it]                                                   71%|███████   | 71/100 [1:32:03<39:06, 80.90s/it] 72%|███████▏  | 72/100 [1:32:03<31:27, 67.41s/it]
    RF: F1=0.798±0.067, BA=0.811±0.060, Acc=0.789±0.077
[I 2026-05-18 17:57:52,817] Trial 64 finished with values: [0.5012139419445862, 0.7704168691718397] and parameters: {'n_estimators': 700, 'max_depth': 22, 'min_samples_leaf': 7, 'max_features': 0.19971689165954998, 'class_weight': 'balanced_subsample'}.

  Task: Thiram Presence (has_thiram), classes=[0, 1], samples=901
    RF: F1=0.859±0.074, BA=0.858±0.071, Acc=0.886±0.068

  Task: MG Presence (has_mg), classes=[0, 1], samples=901
    RF: F1=0.813±0.080, BA=0.810±0.076, Acc=0.857±0.063

  Task: MBA Presence (has_mba), classes=[0, 1], samples=901
    RF: F1=0.865±0.071, BA=0.874±0.073, Acc=0.897±0.064

  Task: Thiram Positive Molar Grade (c_thiram), classes=[4, 5, 6], samples=650
    RF: F1=0.781±0.108, BA=0.829±0.085, Acc=0.778±0.112

  Task: MG Positive Molar Grade (c_mg), classes=[4, 5, 6], samples=648
    RF: F1=0.494±0.093, BA=0.523±0.120, Acc=0.588±0.152

  Task: MBA Positive Molar Grade (c_mba), classes=[4, 5, 6], samples=681
    RF: F1=0.789±0.073, BA=0.800±0.067, Acc=0.779±0.084
[I 2026-05-18 17:58:12,868] Trial 65 finished with values: [0.4937202550262933, 0.7669499522017084] and parameters: {'n_estimators': 200, 'max_depth': 11, 'min_samples_leaf': 7, 'max_features': 0.17462802355441434, 'class_weight': 'balanced'}.

  Task: Thiram Presence (has_thiram), classes=[0, 1], samples=901
    RF: F1=0.855±0.079, BA=0.854±0.074, Acc=0.883±0.074

  Task: MG Presence (has_mg), classes=[0, 1], samples=901
    RF: F1=0.813±0.085, BA=0.811±0.081, Acc=0.857±0.067

  Task: MBA Presence (has_mba), classes=[0, 1], samples=901
    RF: F1=0.871±0.070, BA=0.877±0.073, Acc=0.902±0.062

  Task: Thiram Positive Molar Grade (c_thiram), classes=[4, 5, 6], samples=650
    RF: F1=0.784±0.108, BA=0.831±0.084, Acc=0.782±0.112

  Task: MG Positive Molar Grade (c_mg), classes=[4, 5, 6], samples=648
    RF: F1=0.499±0.088, BA=0.528±0.116, Acc=0.589±0.151

  Task: MBA Positive Molar Grade (c_mba), classes=[4, 5, 6], samples=681
    RF: F1=0.794±0.070, BA=0.806±0.063, Acc=0.785±0.079
[I 2026-05-18 18:00:13,464] Trial 66 finished with values: [0.49913897555508235, 0.7696062004555587] and parameters: {'n_estimators': 1100, 'max_depth': 11, 'min_samples_leaf': 7, 'max_features': 0.22831202598869435, 'class_weight': 'balanced_subsample'}.

  Task: Thiram Presence (has_thiram), classes=[0, 1], samples=901
    RF: F1=0.853±0.083, BA=0.850±0.080, Acc=0.881±0.078

  Task: MG Presence (has_mg), classes=[0, 1], samples=901
    RF: F1=0.817±0.078, BA=0.815±0.073, Acc=0.858±0.066

  Task: MBA Presence (has_mba), classes=[0, 1], samples=901
    RF: F1=0.866±0.073, BA=0.873±0.077, Acc=0.898±0.064

  Task: Thiram Positive Molar Grade (c_thiram), classes=[4, 5, 6], samples=650
    RF: F1=0.784±0.106, BA=0.832±0.082, Acc=0.781±0.110

  Task: MG Positive Molar Grade (c_mg), classes=[4, 5, 6], samples=648
    RF: F1=0.503±0.088, BA=0.532±0.117, Acc=0.593±0.152

  Task: MBA Positive Molar Grade (c_mba), classes=[4, 5, 6], samples=681
    RF: F1=0.794±0.070, BA=0.804±0.065, Acc=0.785±0.080
[I 2026-05-18 18:01:20,720] Trial 67 finished with values: [0.502632117139983, 0.7694513391941911] and parameters: {'n_estimators': 600, 'max_depth': 16, 'min_samples_leaf': 7, 'max_features': 0.1746074041599417, 'class_weight': 'balanced_subsample'}.

  Task: Thiram Presence (has_thiram), classes=[0, 1], samples=901
    RF: F1=0.818±0.109, BA=0.798±0.098, Acc=0.865±0.079

  Task: MG Presence (has_mg), classes=[0, 1], samples=901
    RF: F1=0.798±0.055, BA=0.781±0.052, Acc=0.852±0.045

  Task: MBA Presence (has_mba), classes=[0, 1], samples=901
    RF: F1=0.862±0.080, BA=0.866±0.086, Acc=0.898±0.067

  Task: Thiram Positive Molar Grade (c_thiram), classes=[4, 5, 6], samples=650
    RF: F1=0.793±0.112, BA=0.843±0.084, Acc=0.789±0.118

  Task: MG Positive Molar Grade (c_mg), classes=[4, 5, 6], samples=648
    RF: F1=0.482±0.095, BA=0.512±0.124, Acc=0.571±0.146

  Task: MBA Positive Molar Grade (c_mba), classes=[4, 5, 6], samples=681
    RF: F1=0.770±0.088, BA=0.779±0.089, Acc=0.761±0.100
[I 2026-05-18 18:02:49,063] Trial 68 finished with values: [0.4816079209500813, 0.7538499673269635] and parameters: {'n_estimators': 800, 'max_depth': 11, 'min_samples_leaf': 1, 'max_features': 0.17462802355441434, 'class_weight': 'balanced_subsample'}.

  Task: Thiram Presence (has_thiram), classes=[0, 1], samples=901
    RF: F1=0.822±0.112, BA=0.803±0.101, Acc=0.868±0.081

  Task: MG Presence (has_mg), classes=[0, 1], samples=901
    RF: F1=0.789±0.047, BA=0.772±0.044, Acc=0.847±0.040

  Task: MBA Presence (has_mba), classes=[0, 1], samples=901
    RF: F1=0.858±0.079, BA=0.862±0.084, Acc=0.895±0.067

  Task: Thiram Positive Molar Grade (c_thiram), classes=[4, 5, 6], samples=650
    RF: F1=0.795±0.115, BA=0.844±0.086, Acc=0.791±0.120

  Task: MG Positive Molar Grade (c_mg), classes=[4, 5, 6], samples=648
    RF: F1=0.489±0.093, BA=0.520±0.121, Acc=0.578±0.147

  Task: MBA Positive Molar Grade (c_mba), classes=[4, 5, 6], samples=681
    RF: F1=0.788±0.082, BA=0.798±0.078, Acc=0.779±0.096
[I 2026-05-18 18:04:17,050] Trial 69 finished with values: [0.48888936284499546, 0.7568344365453812] and parameters: {'n_estimators': 800, 'max_depth': 26, 'min_samples_leaf': 1, 'max_features': 0.15579754426081674, 'class_weight': 'balanced_subsample'}.

  Task: Thiram Presence (has_thiram), classes=[0, 1], samples=901
    RF: F1=0.854±0.083, BA=0.851±0.077, Acc=0.882±0.077

  Task: MG Presence (has_mg), classes=[0, 1], samples=901
    RF: F1=0.817±0.082, BA=0.814±0.078, Acc=0.858±0.067

  Task: MBA Presence (has_mba), classes=[0, 1], samples=901
    RF: F1=0.865±0.070, BA=0.873±0.077, Acc=0.898±0.062

  Task: Thiram Positive Molar Grade (c_thiram), classes=[4, 5, 6], samples=650
    RF: F1=0.784±0.106, BA=0.832±0.082, Acc=0.781±0.110

  Task: MG Positive Molar Grade (c_mg), classes=[4, 5, 6], samples=648
    RF: F1=0.503±0.086, BA=0.532±0.114, Acc=0.592±0.151

  Task: MBA Positive Molar Grade (c_mba), classes=[4, 5, 6], samples=681
    RF: F1=0.793±0.071, BA=0.803±0.066, Acc=0.782±0.082
[I 2026-05-18 18:05:34,443] Trial 70 finished with values: [0.5025450129320334, 0.7691732379687332] and parameters: {'n_estimators': 700, 'max_depth': 14, 'min_samples_leaf': 6, 'max_features': 0.16974657160199658, 'class_weight': 'balanced_subsample'}.

  Task: Thiram Presence (has_thiram), classes=[0, 1], samples=901
    RF: F1=0.858±0.079, BA=0.856±0.075, Acc=0.885±0.073

  Task: MG Presence (has_mg), classes=[0, 1], samples=901
    RF: F1=0.818±0.077, BA=0.815±0.071, Acc=0.859±0.063

  Task: MBA Presence (has_mba), classes=[0, 1], samples=901
    RF: F1=0.862±0.077, BA=0.871±0.082, Acc=0.896±0.067

  Task: Thiram Positive Molar Grade (c_thiram), classes=[4, 5, 6], samples=650
    RF: F1=0.783±0.108, BA=0.830±0.085, Acc=0.780±0.112

  Task: MG Positive Molar Grade (c_mg), classes=[4, 5, 6], samples=648
    RF: F1=0.501±0.089, BA=0.531±0.117, Acc=0.591±0.152

  Task: MBA Positive Molar Grade (c_mba), classes=[4, 5, 6], samples=681
    RF: F1=0.794±0.072, BA=0.805±0.067, Acc=0.785±0.082
[I 2026-05-18 18:06:10,393] Trial 71 finished with values: [0.501467189520812, 0.7692837805286611] and parameters: {'n_estimators': 300, 'max_depth': 27, 'min_samples_leaf': 7, 'max_features': 0.17462802355441434, 'class_weight': 'balanced_subsample'}.

  Task: Thiram Presence (has_thiram), classes=[0, 1], samples=901
    RF: F1=0.853±0.087, BA=0.853±0.077, Acc=0.880±0.080

  Task: MG Presence (has_mg), classes=[0, 1], samples=901
    RF: F1=0.808±0.088, BA=0.807±0.083, Acc=0.850±0.072

  Task: MBA Presence (has_mba), classes=[0, 1], samples=901
    RF: F1=0.868±0.070, BA=0.874±0.074, Acc=0.900±0.062

  Task: Thiram Positive Molar Grade (c_thiram), classes=[4, 5, 6], samples=650
    RF: F1=0.786±0.106, BA=0.833±0.082, Acc=0.783±0.110

  Task: MG Positive Molar Grade (c_mg), classes=[4, 5, 6], samples=648
    RF: F1=0.498±0.093, BA=0.524±0.118, Acc=0.587±0.151

  Task: MBA Positive Molar Grade (c_mba), classes=[4, 5, 6], samples=681
    RF: F1=0.798±0.067, BA=0.809±0.061, Acc=0.789±0.076                                                   72%|███████▏  | 72/100 [1:32:40<31:27, 67.41s/it] 73%|███████▎  | 73/100 [1:32:40<26:09, 58.11s/it]                                                   73%|███████▎  | 73/100 [1:33:47<26:09, 58.11s/it] 74%|███████▍  | 74/100 [1:33:47<26:24, 60.93s/it]                                                   74%|███████▍  | 74/100 [1:34:39<26:24, 60.93s/it] 75%|███████▌  | 75/100 [1:34:39<24:13, 58.12s/it]                                                   75%|███████▌  | 75/100 [1:36:07<24:13, 58.12s/it] 76%|███████▌  | 76/100 [1:36:07<26:50, 67.12s/it]                                                   76%|███████▌  | 76/100 [1:38:18<26:50, 67.12s/it] 77%|███████▋  | 77/100 [1:38:18<33:07, 86.41s/it]                                                   77%|███████▋  | 77/100 [1:40:07<33:07, 86.41s/it] 78%|███████▊  | 78/100 [1:40:07<34:08, 93.13s/it]                                                   78%|███████▊  | 78/100 [1:40:46<34:08, 93.13s/it] 79%|███████▉  | 79/100 [1:40:46<26:54, 76.90s/it]                                                   79%|███████▉  | 79/100 [1:42:14<26:54, 76.90s/it] 80%|████████  | 80/100 [1:42:14<26:43, 80.17s/it]                                                  
[I 2026-05-18 18:06:46,803] Trial 72 finished with values: [0.497698579184137, 0.7684493644996987] and parameters: {'n_estimators': 300, 'max_depth': 10, 'min_samples_leaf': 8, 'max_features': 0.2114585856946446, 'class_weight': 'balanced_subsample'}.

  Task: Thiram Presence (has_thiram), classes=[0, 1], samples=901
    RF: F1=0.857±0.077, BA=0.854±0.071, Acc=0.885±0.071

  Task: MG Presence (has_mg), classes=[0, 1], samples=901
    RF: F1=0.816±0.073, BA=0.811±0.068, Acc=0.859±0.060

  Task: MBA Presence (has_mba), classes=[0, 1], samples=901
    RF: F1=0.872±0.067, BA=0.880±0.076, Acc=0.903±0.059

  Task: Thiram Positive Molar Grade (c_thiram), classes=[4, 5, 6], samples=650
    RF: F1=0.787±0.110, BA=0.834±0.086, Acc=0.784±0.115

  Task: MG Positive Molar Grade (c_mg), classes=[4, 5, 6], samples=648
    RF: F1=0.503±0.088, BA=0.533±0.116, Acc=0.594±0.151

  Task: MBA Positive Molar Grade (c_mba), classes=[4, 5, 6], samples=681
    RF: F1=0.784±0.073, BA=0.795±0.069, Acc=0.774±0.085
