[I 2026-05-18 16:56:05,886] Trial 17 finished with values: [0.4991569065287722, 0.7672515151366776] and parameters: {'n_estimators': 500, 'max_depth': 22, 'min_samples_leaf': 8, 'max_features': 0.19971689165954998, 'class_weight': 'balanced_subsample'}.

  Task: Thiram Presence (has_thiram), classes=[0, 1], samples=901
    RF: F1=0.834±0.099, BA=0.818±0.083, Acc=0.873±0.076

  Task: MG Presence (has_mg), classes=[0, 1], samples=901
    RF: F1=0.806±0.055, BA=0.794±0.048, Acc=0.855±0.044

  Task: MBA Presence (has_mba), classes=[0, 1], samples=901
    RF: F1=0.870±0.069, BA=0.874±0.075, Acc=0.902±0.060

  Task: Thiram Positive Molar Grade (c_thiram), classes=[4, 5, 6], samples=650
    RF: F1=0.793±0.112, BA=0.843±0.084, Acc=0.789±0.118

  Task: MG Positive Molar Grade (c_mg), classes=[4, 5, 6], samples=648
    RF: F1=0.487±0.097, BA=0.517±0.125, Acc=0.583±0.154

  Task: MBA Positive Molar Grade (c_mba), classes=[4, 5, 6], samples=681
    RF: F1=0.787±0.080, BA=0.797±0.075, Acc=0.776±0.093
[I 2026-05-18 16:56:43,277] Trial 18 finished with values: [0.48650715082364665, 0.7626750569621527] and parameters: {'n_estimators': 400, 'max_depth': 10, 'min_samples_leaf': 3, 'max_features': 0.16448851490160177, 'class_weight': 'balanced'}.

  Task: Thiram Presence (has_thiram), classes=[0, 1], samples=901
    RF: F1=0.855±0.085, BA=0.853±0.082, Acc=0.883±0.079

  Task: MG Presence (has_mg), classes=[0, 1], samples=901
    RF: F1=0.818±0.079, BA=0.816±0.074, Acc=0.859±0.063

  Task: MBA Presence (has_mba), classes=[0, 1], samples=901
    RF: F1=0.867±0.070, BA=0.875±0.074, Acc=0.899±0.063

  Task: Thiram Positive Molar Grade (c_thiram), classes=[4, 5, 6], samples=650
    RF: F1=0.783±0.108, BA=0.830±0.085, Acc=0.780±0.112

  Task: MG Positive Molar Grade (c_mg), classes=[4, 5, 6], samples=648
    RF: F1=0.501±0.087, BA=0.530±0.114, Acc=0.592±0.150

  Task: MBA Positive Molar Grade (c_mba), classes=[4, 5, 6], samples=681
    RF: F1=0.791±0.075, BA=0.802±0.068, Acc=0.779±0.086
[I 2026-05-18 16:57:52,619] Trial 19 finished with values: [0.5012275588811146, 0.7692107271351438] and parameters: {'n_estimators': 800, 'max_depth': 32, 'min_samples_leaf': 7, 'max_features': 0.17462802355441434, 'class_weight': 'balanced'}.

  Task: Thiram Presence (has_thiram), classes=[0, 1], samples=901
    RF: F1=0.856±0.080, BA=0.854±0.077, Acc=0.883±0.076

  Task: MG Presence (has_mg), classes=[0, 1], samples=901
    RF: F1=0.799±0.084, BA=0.795±0.079, Acc=0.845±0.070

  Task: MBA Presence (has_mba), classes=[0, 1], samples=901
    RF: F1=0.868±0.073, BA=0.873±0.073, Acc=0.900±0.065

  Task: Thiram Positive Molar Grade (c_thiram), classes=[4, 5, 6], samples=650
    RF: F1=0.781±0.109, BA=0.826±0.087, Acc=0.778±0.113

  Task: MG Positive Molar Grade (c_mg), classes=[4, 5, 6], samples=648
    RF: F1=0.487±0.090, BA=0.519±0.117, Acc=0.583±0.153

  Task: MBA Positive Molar Grade (c_mba), classes=[4, 5, 6], samples=681
    RF: F1=0.791±0.071, BA=0.804±0.062, Acc=0.782±0.081
[I 2026-05-18 16:59:54,820] Trial 20 finished with values: [0.4874522873762481, 0.7636950612575043] and parameters: {'n_estimators': 1000, 'max_depth': 33, 'min_samples_leaf': 7, 'max_features': 0.3245108790277985, 'class_weight': 'balanced'}.

  Task: Thiram Presence (has_thiram), classes=[0, 1], samples=901
    RF: F1=0.849±0.090, BA=0.849±0.089, Acc=0.877±0.084

  Task: MG Presence (has_mg), classes=[0, 1], samples=901
    RF: F1=0.802±0.082, BA=0.797±0.077, Acc=0.848±0.067

  Task: MBA Presence (has_mba), classes=[0, 1], samples=901
    RF: F1=0.873±0.071, BA=0.876±0.071, Acc=0.903±0.063

  Task: Thiram Positive Molar Grade (c_thiram), classes=[4, 5, 6], samples=650
    RF: F1=0.787±0.109, BA=0.833±0.083, Acc=0.784±0.114

  Task: MG Positive Molar Grade (c_mg), classes=[4, 5, 6], samples=648
    RF: F1=0.488±0.092, BA=0.521±0.119, Acc=0.585±0.153

  Task: MBA Positive Molar Grade (c_mba), classes=[4, 5, 6], samples=681
    RF: F1=0.786±0.069, BA=0.798±0.061, Acc=0.776±0.079
[I 2026-05-18 17:01:14,286] Trial 21 finished with values: [0.4884160785255845, 0.7641922814721761] and parameters: {'n_estimators': 600, 'max_depth': 34, 'min_samples_leaf': 6, 'max_features': 0.3394633936788146, 'class_weight': 'balanced'}.

  Task: Thiram Presence (has_thiram), classes=[0, 1], samples=901
    RF: F1=0.855±0.084, BA=0.854±0.082, Acc=0.880±0.081

  Task: MG Presence (has_mg), classes=[0, 1], samples=901
    RF: F1=0.802±0.083, BA=0.797±0.078, Acc=0.848±0.068

  Task: MBA Presence (has_mba), classes=[0, 1], samples=901
    RF: F1=0.873±0.070, BA=0.876±0.068, Acc=0.903±0.063

  Task: Thiram Positive Molar Grade (c_thiram), classes=[4, 5, 6], samples=650
    RF: F1=0.784±0.109, BA=0.829±0.085, Acc=0.782±0.114

  Task: MG Positive Molar Grade (c_mg), classes=[4, 5, 6], samples=648
    RF: F1=0.487±0.090, BA=0.519±0.117, Acc=0.583±0.153

  Task: MBA Positive Molar Grade (c_mba), classes=[4, 5, 6], samples=681
    RF: F1=0.788±0.070, BA=0.801±0.060, Acc=0.779±0.079
[I 2026-05-18 17:02:59,353] Trial 22 finished with values: [0.4874522873762481, 0.7649489897739962] and parameters: {'n_estimators': 800, 'max_depth': 16, 'min_samples_leaf': 7, 'max_features': 0.35502298854208525, 'class_weight': 'balanced'}.

  Task: Thiram Presence (has_thiram), classes=[0, 1], samples=901
    RF: F1=0.858±0.079, BA=0.856±0.075, Acc=0.885±0.073

  Task: MG Presence (has_mg), classes=[0, 1], samples=901
    RF: F1=0.818±0.077, BA=0.815±0.071, Acc=0.859±0.063

  Task: MBA Presence (has_mba), classes=[0, 1], samples=901
    RF: F1=0.862±0.077, BA=0.871±0.082, Acc=0.896±0.067

  Task: Thiram Positive Molar Grade (c_thiram), classes=[4, 5, 6], samples=650
    RF: F1=0.783±0.108, BA=0.830±0.085, Acc=0.780±0.112

  Task: MG Positive Molar Grade (c_mg), classes=[4, 5, 6], samples=648
    RF: F1=0.501±0.089, BA=0.531±0.117, Acc=0.591±0.152

  Task: MBA Positive Molar Grade (c_mba), classes=[4, 5, 6], samples=681
    RF: F1=0.794±0.072, BA=0.805±0.067, Acc=0.785±0.082
[I 2026-05-18 17:03:35,169] Trial 23 finished with values: [0.501467189520812, 0.7692837805286611] and parameters: {'n_estimators': 300, 'max_depth': 10, 'min_samples_leaf': 7, 'max_features': 0.17462802355441434, 'class_weight': 'balanced_subsample'}.

  Task: Thiram Presence (has_thiram), classes=[0, 1], samples=901
    RF: F1=0.859±0.080, BA=0.860±0.077, Acc=0.884±0.077

  Task: MG Presence (has_mg), classes=[0, 1], samples=901
    RF: F1=0.802±0.065, BA=0.793±0.059, Acc=0.849±0.057

  Task: MBA Presence (has_mba), classes=[0, 1], samples=901                                                   24%|██▍       | 24/100 [30:03<1:30:16, 71.28s/it] 25%|██▌       | 25/100 [30:03<1:15:28, 60.38s/it]                                                   25%|██▌       | 25/100 [30:57<1:15:28, 60.38s/it] 26%|██▌       | 26/100 [30:57<1:12:04, 58.45s/it]                                                   26%|██▌       | 26/100 [32:32<1:12:04, 58.45s/it] 27%|██▋       | 27/100 [32:32<1:24:22, 69.34s/it]                                                   27%|██▋       | 27/100 [33:47<1:24:22, 69.34s/it] 28%|██▊       | 28/100 [33:47<1:25:15, 71.05s/it]                                                   28%|██▊       | 28/100 [35:16<1:25:15, 71.05s/it] 29%|██▉       | 29/100 [35:16<1:30:22, 76.38s/it]                                                   29%|██▉       | 29/100 [36:24<1:30:22, 76.38s/it] 30%|███       | 30/100 [36:24<1:26:26, 74.10s/it]                                                   30%|███       | 30/100 [37:23<1:26:26, 74.10s/it] 31%|███       | 31/100 [37:23<1:19:48, 69.40s/it]                                                   31%|███       | 31/100 [38:15<1:19:48, 69.40s/it] 32%|███▏      | 32/100 [38:15<1:12:46, 64.22s/it]
    RF: F1=0.875±0.070, BA=0.876±0.068, Acc=0.906±0.062

  Task: Thiram Positive Molar Grade (c_thiram), classes=[4, 5, 6], samples=650
    RF: F1=0.785±0.109, BA=0.830±0.084, Acc=0.782±0.114

  Task: MG Positive Molar Grade (c_mg), classes=[4, 5, 6], samples=648
    RF: F1=0.486±0.094, BA=0.518±0.121, Acc=0.582±0.155

  Task: MBA Positive Molar Grade (c_mba), classes=[4, 5, 6], samples=681
    RF: F1=0.776±0.071, BA=0.788±0.063, Acc=0.767±0.081
[I 2026-05-18 17:04:10,145] Trial 24 finished with values: [0.48631514249356494, 0.7638567226230163] and parameters: {'n_estimators': 200, 'max_depth': 15, 'min_samples_leaf': 5, 'max_features': 0.3832290311184182, 'class_weight': 'balanced_subsample'}.

  Task: Thiram Presence (has_thiram), classes=[0, 1], samples=901
    RF: F1=0.855±0.073, BA=0.857±0.067, Acc=0.881±0.072

  Task: MG Presence (has_mg), classes=[0, 1], samples=901
    RF: F1=0.799±0.080, BA=0.795±0.074, Acc=0.845±0.067

  Task: MBA Presence (has_mba), classes=[0, 1], samples=901
    RF: F1=0.876±0.068, BA=0.878±0.068, Acc=0.906±0.060

  Task: Thiram Positive Molar Grade (c_thiram), classes=[4, 5, 6], samples=650
    RF: F1=0.781±0.110, BA=0.825±0.088, Acc=0.779±0.115

  Task: MG Positive Molar Grade (c_mg), classes=[4, 5, 6], samples=648
    RF: F1=0.485±0.089, BA=0.517±0.116, Acc=0.580±0.153

  Task: MBA Positive Molar Grade (c_mba), classes=[4, 5, 6], samples=681
    RF: F1=0.786±0.070, BA=0.798±0.062, Acc=0.777±0.080
[I 2026-05-18 17:05:04,065] Trial 25 finished with values: [0.4852339360581482, 0.7637126422669396] and parameters: {'n_estimators': 400, 'max_depth': 11, 'min_samples_leaf': 8, 'max_features': 0.3493192507310232, 'class_weight': 'balanced'}.

  Task: Thiram Presence (has_thiram), classes=[0, 1], samples=901
    RF: F1=0.850±0.085, BA=0.848±0.082, Acc=0.878±0.080

  Task: MG Presence (has_mg), classes=[0, 1], samples=901
    RF: F1=0.807±0.080, BA=0.803±0.074, Acc=0.850±0.067

  Task: MBA Presence (has_mba), classes=[0, 1], samples=901
    RF: F1=0.870±0.071, BA=0.877±0.073, Acc=0.901±0.063

  Task: Thiram Positive Molar Grade (c_thiram), classes=[4, 5, 6], samples=650
    RF: F1=0.788±0.108, BA=0.833±0.083, Acc=0.785±0.113

  Task: MG Positive Molar Grade (c_mg), classes=[4, 5, 6], samples=648
    RF: F1=0.496±0.087, BA=0.525±0.114, Acc=0.585±0.152

  Task: MBA Positive Molar Grade (c_mba), classes=[4, 5, 6], samples=681
    RF: F1=0.793±0.069, BA=0.805±0.061, Acc=0.785±0.078
[I 2026-05-18 17:06:38,836] Trial 26 finished with values: [0.4959151985109149, 0.7673947290266776] and parameters: {'n_estimators': 800, 'max_depth': 10, 'min_samples_leaf': 8, 'max_features': 0.27606099749584057, 'class_weight': 'balanced_subsample'}.

  Task: Thiram Presence (has_thiram), classes=[0, 1], samples=901
    RF: F1=0.854±0.087, BA=0.852±0.087, Acc=0.882±0.080

  Task: MG Presence (has_mg), classes=[0, 1], samples=901
    RF: F1=0.799±0.074, BA=0.789±0.071, Acc=0.851±0.055

  Task: MBA Presence (has_mba), classes=[0, 1], samples=901
    RF: F1=0.876±0.063, BA=0.878±0.063, Acc=0.906±0.058

  Task: Thiram Positive Molar Grade (c_thiram), classes=[4, 5, 6], samples=650
    RF: F1=0.784±0.108, BA=0.831±0.084, Acc=0.782±0.112

  Task: MG Positive Molar Grade (c_mg), classes=[4, 5, 6], samples=648
    RF: F1=0.484±0.092, BA=0.516±0.120, Acc=0.579±0.155

  Task: MBA Positive Molar Grade (c_mba), classes=[4, 5, 6], samples=681
    RF: F1=0.784±0.072, BA=0.797±0.064, Acc=0.775±0.082
[I 2026-05-18 17:07:53,873] Trial 27 finished with values: [0.4843896250199897, 0.7636180299611809] and parameters: {'n_estimators': 500, 'max_depth': 11, 'min_samples_leaf': 4, 'max_features': 0.3493192507310232, 'class_weight': 'balanced_subsample'}.

  Task: Thiram Presence (has_thiram), classes=[0, 1], samples=901
    RF: F1=0.856±0.081, BA=0.854±0.077, Acc=0.883±0.076

  Task: MG Presence (has_mg), classes=[0, 1], samples=901
    RF: F1=0.816±0.078, BA=0.813±0.073, Acc=0.858±0.064

  Task: MBA Presence (has_mba), classes=[0, 1], samples=901
    RF: F1=0.864±0.071, BA=0.872±0.077, Acc=0.897±0.063

  Task: Thiram Positive Molar Grade (c_thiram), classes=[4, 5, 6], samples=650
    RF: F1=0.784±0.106, BA=0.832±0.082, Acc=0.781±0.110

  Task: MG Positive Molar Grade (c_mg), classes=[4, 5, 6], samples=648
    RF: F1=0.505±0.087, BA=0.534±0.115, Acc=0.595±0.151

  Task: MBA Positive Molar Grade (c_mba), classes=[4, 5, 6], samples=681
    RF: F1=0.792±0.072, BA=0.802±0.066, Acc=0.782±0.082
[I 2026-05-18 17:09:22,679] Trial 28 finished with values: [0.504595946713747, 0.7693353939478342] and parameters: {'n_estimators': 800, 'max_depth': 30, 'min_samples_leaf': 7, 'max_features': 0.17462802355441434, 'class_weight': 'balanced_subsample'}.

  Task: Thiram Presence (has_thiram), classes=[0, 1], samples=901
    RF: F1=0.858±0.077, BA=0.859±0.074, Acc=0.884±0.074

  Task: MG Presence (has_mg), classes=[0, 1], samples=901
    RF: F1=0.796±0.077, BA=0.788±0.072, Acc=0.846±0.061

  Task: MBA Presence (has_mba), classes=[0, 1], samples=901
    RF: F1=0.873±0.071, BA=0.876±0.071, Acc=0.903±0.063

  Task: Thiram Positive Molar Grade (c_thiram), classes=[4, 5, 6], samples=650
    RF: F1=0.784±0.108, BA=0.831±0.083, Acc=0.780±0.113

  Task: MG Positive Molar Grade (c_mg), classes=[4, 5, 6], samples=648
    RF: F1=0.488±0.090, BA=0.520±0.116, Acc=0.584±0.152

  Task: MBA Positive Molar Grade (c_mba), classes=[4, 5, 6], samples=681
    RF: F1=0.788±0.069, BA=0.801±0.060, Acc=0.779±0.078
[I 2026-05-18 17:10:31,451] Trial 29 finished with values: [0.4883823649382502, 0.7645683801283822] and parameters: {'n_estimators': 500, 'max_depth': 10, 'min_samples_leaf': 6, 'max_features': 0.3493192507310232, 'class_weight': 'balanced'}.

  Task: Thiram Presence (has_thiram), classes=[0, 1], samples=901
    RF: F1=0.819±0.114, BA=0.800±0.102, Acc=0.866±0.082

  Task: MG Presence (has_mg), classes=[0, 1], samples=901
    RF: F1=0.793±0.056, BA=0.776±0.050, Acc=0.848±0.048

  Task: MBA Presence (has_mba), classes=[0, 1], samples=901
    RF: F1=0.866±0.092, BA=0.872±0.095, Acc=0.901±0.073

  Task: Thiram Positive Molar Grade (c_thiram), classes=[4, 5, 6], samples=650
    RF: F1=0.797±0.114, BA=0.846±0.085, Acc=0.792±0.119

  Task: MG Positive Molar Grade (c_mg), classes=[4, 5, 6], samples=648
    RF: F1=0.482±0.095, BA=0.511±0.123, Acc=0.572±0.149

  Task: MBA Positive Molar Grade (c_mba), classes=[4, 5, 6], samples=681
    RF: F1=0.778±0.093, BA=0.785±0.095, Acc=0.769±0.106
[I 2026-05-18 17:11:29,885] Trial 30 finished with values: [0.482418094199053, 0.7558870943979303] and parameters: {'n_estimators': 500, 'max_depth': 22, 'min_samples_leaf': 1, 'max_features': 0.1431565707973218, 'class_weight': 'balanced_subsample'}.

  Task: Thiram Presence (has_thiram), classes=[0, 1], samples=901
    RF: F1=0.859±0.083, BA=0.856±0.077, Acc=0.886±0.076

  Task: MG Presence (has_mg), classes=[0, 1], samples=901
    RF: F1=0.818±0.066, BA=0.808±0.061, Acc=0.862±0.053

  Task: MBA Presence (has_mba), classes=[0, 1], samples=901
    RF: F1=0.873±0.068, BA=0.879±0.073, Acc=0.903±0.061

  Task: Thiram Positive Molar Grade (c_thiram), classes=[4, 5, 6], samples=650
    RF: F1=0.788±0.112, BA=0.836±0.086, Acc=0.785±0.117

  Task: MG Positive Molar Grade (c_mg), classes=[4, 5, 6], samples=648
    RF: F1=0.492±0.094, BA=0.521±0.122, Acc=0.586±0.153

  Task: MBA Positive Molar Grade (c_mba), classes=[4, 5, 6], samples=681
    RF: F1=0.786±0.078, BA=0.797±0.073, Acc=0.774±0.091
[I 2026-05-18 17:12:22,023] Trial 31 finished with values: [0.4918577792232769, 0.7692008817498235] and parameters: {'n_estimators': 600, 'max_depth': 12, 'min_samples_leaf': 4, 'max_features': 0.15579754426081674, 'class_weight': 'balanced'}.

  Task: Thiram Presence (has_thiram), classes=[0, 1], samples=901
    RF: F1=0.853±0.083, BA=0.850±0.080, Acc=0.881±0.078

  Task: MG Presence (has_mg), classes=[0, 1], samples=901
    RF: F1=0.817±0.078, BA=0.815±0.073, Acc=0.858±0.066

  Task: MBA Presence (has_mba), classes=[0, 1], samples=901
    RF: F1=0.866±0.073, BA=0.873±0.077, Acc=0.898±0.064
                                                   32%|███▏      | 32/100 [39:23<1:12:46, 64.22s/it] 33%|███▎      | 33/100 [39:23<1:12:57, 65.34s/it]                                                   33%|███▎      | 33/100 [42:11<1:12:57, 65.34s/it] 34%|███▍      | 34/100 [42:11<1:45:40, 96.06s/it]                                                   34%|███▍      | 34/100 [43:42<1:45:40, 96.06s/it] 35%|███▌      | 35/100 [43:42<1:42:24, 94.53s/it]                                                   35%|███▌      | 35/100 [44:49<1:42:24, 94.53s/it] 36%|███▌      | 36/100 [44:49<1:32:07, 86.36s/it]                                                   36%|███▌      | 36/100 [45:17<1:32:07, 86.36s/it] 37%|███▋      | 37/100 [45:17<1:12:17, 68.85s/it]                                                   37%|███▋      | 37/100 [46:34<1:12:17, 68.85s/it] 38%|███▊      | 38/100 [46:34<1:13:31, 71.15s/it]                                                   38%|███▊      | 38/100 [47:46<1:13:31, 71.15s/it] 39%|███▉      | 39/100 [47:46<1:12:40, 71.49s/it]                                                   39%|███▉      | 39/100 [50:18<1:12:40, 71.49s/it] 40%|████      | 40/100 [50:18<1:35:44, 95.75s/it]
  Task: Thiram Positive Molar Grade (c_thiram), classes=[4, 5, 6], samples=650
    RF: F1=0.784±0.106, BA=0.832±0.082, Acc=0.781±0.110

  Task: MG Positive Molar Grade (c_mg), classes=[4, 5, 6], samples=648
    RF: F1=0.503±0.088, BA=0.532±0.117, Acc=0.593±0.152

  Task: MBA Positive Molar Grade (c_mba), classes=[4, 5, 6], samples=681
    RF: F1=0.794±0.070, BA=0.804±0.065, Acc=0.785±0.080
[I 2026-05-18 17:13:29,961] Trial 32 finished with values: [0.502632117139983, 0.7694513391941911] and parameters: {'n_estimators': 600, 'max_depth': 16, 'min_samples_leaf': 7, 'max_features': 0.17462802355441434, 'class_weight': 'balanced_subsample'}.

  Task: Thiram Presence (has_thiram), classes=[0, 1], samples=901
    RF: F1=0.809±0.125, BA=0.792±0.113, Acc=0.856±0.095

  Task: MG Presence (has_mg), classes=[0, 1], samples=901
    RF: F1=0.796±0.064, BA=0.781±0.061, Acc=0.851±0.048

  Task: MBA Presence (has_mba), classes=[0, 1], samples=901
    RF: F1=0.879±0.066, BA=0.877±0.066, Acc=0.909±0.058

  Task: Thiram Positive Molar Grade (c_thiram), classes=[4, 5, 6], samples=650
    RF: F1=0.787±0.111, BA=0.835±0.084, Acc=0.783±0.116

  Task: MG Positive Molar Grade (c_mg), classes=[4, 5, 6], samples=648
    RF: F1=0.484±0.088, BA=0.516±0.117, Acc=0.573±0.141

  Task: MBA Positive Molar Grade (c_mba), classes=[4, 5, 6], samples=681
    RF: F1=0.785±0.072, BA=0.797±0.065, Acc=0.775±0.084
[I 2026-05-18 17:16:17,717] Trial 33 finished with values: [0.48384438724393936, 0.7565652065648535] and parameters: {'n_estimators': 1100, 'max_depth': 33, 'min_samples_leaf': 2, 'max_features': 0.36500891374159283, 'class_weight': 'balanced_subsample'}.

  Task: Thiram Presence (has_thiram), classes=[0, 1], samples=901
    RF: F1=0.851±0.090, BA=0.850±0.086, Acc=0.879±0.083

  Task: MG Presence (has_mg), classes=[0, 1], samples=901
    RF: F1=0.807±0.083, BA=0.804±0.077, Acc=0.851±0.065

  Task: MBA Presence (has_mba), classes=[0, 1], samples=901
    RF: F1=0.870±0.071, BA=0.875±0.073, Acc=0.901±0.063

  Task: Thiram Positive Molar Grade (c_thiram), classes=[4, 5, 6], samples=650
    RF: F1=0.789±0.107, BA=0.834±0.081, Acc=0.785±0.113

  Task: MG Positive Molar Grade (c_mg), classes=[4, 5, 6], samples=648
    RF: F1=0.498±0.090, BA=0.527±0.117, Acc=0.589±0.153

  Task: MBA Positive Molar Grade (c_mba), classes=[4, 5, 6], samples=681
    RF: F1=0.796±0.071, BA=0.809±0.062, Acc=0.786±0.080
[I 2026-05-18 17:17:48,682] Trial 34 finished with values: [0.4981265283894721, 0.7685171110863586] and parameters: {'n_estimators': 800, 'max_depth': 15, 'min_samples_leaf': 7, 'max_features': 0.2427013306774357, 'class_weight': 'balanced_subsample'}.

  Task: Thiram Presence (has_thiram), classes=[0, 1], samples=901
    RF: F1=0.850±0.089, BA=0.848±0.086, Acc=0.879±0.081

  Task: MG Presence (has_mg), classes=[0, 1], samples=901
    RF: F1=0.813±0.079, BA=0.808±0.074, Acc=0.857±0.064

  Task: MBA Presence (has_mba), classes=[0, 1], samples=901
    RF: F1=0.872±0.070, BA=0.879±0.074, Acc=0.902±0.062

  Task: Thiram Positive Molar Grade (c_thiram), classes=[4, 5, 6], samples=650
    RF: F1=0.788±0.106, BA=0.834±0.081, Acc=0.785±0.111

  Task: MG Positive Molar Grade (c_mg), classes=[4, 5, 6], samples=648
    RF: F1=0.498±0.088, BA=0.527±0.116, Acc=0.588±0.151

  Task: MBA Positive Molar Grade (c_mba), classes=[4, 5, 6], samples=681
    RF: F1=0.789±0.073, BA=0.800±0.068, Acc=0.779±0.083
[I 2026-05-18 17:18:55,980] Trial 35 finished with values: [0.4981222921286155, 0.7684565369047359] and parameters: {'n_estimators': 600, 'max_depth': 16, 'min_samples_leaf': 6, 'max_features': 0.1888431241882921, 'class_weight': 'balanced_subsample'}.

  Task: Thiram Presence (has_thiram), classes=[0, 1], samples=901
    RF: F1=0.854±0.088, BA=0.853±0.083, Acc=0.882±0.080

  Task: MG Presence (has_mg), classes=[0, 1], samples=901
    RF: F1=0.813±0.077, BA=0.811±0.071, Acc=0.856±0.062

  Task: MBA Presence (has_mba), classes=[0, 1], samples=901
    RF: F1=0.865±0.075, BA=0.875±0.079, Acc=0.898±0.066

  Task: Thiram Positive Molar Grade (c_thiram), classes=[4, 5, 6], samples=650
    RF: F1=0.781±0.108, BA=0.829±0.085, Acc=0.778±0.112

  Task: MG Positive Molar Grade (c_mg), classes=[4, 5, 6], samples=648
    RF: F1=0.497±0.091, BA=0.527±0.118, Acc=0.591±0.151

  Task: MBA Positive Molar Grade (c_mba), classes=[4, 5, 6], samples=681
    RF: F1=0.795±0.073, BA=0.805±0.067, Acc=0.785±0.084
