[I 2026-05-18 17:19:23,961] Trial 36 finished with values: [0.497186798015154, 0.7676903808070632] and parameters: {'n_estimators': 300, 'max_depth': 17, 'min_samples_leaf': 7, 'max_features': 0.17462802355441434, 'class_weight': 'balanced'}.

  Task: Thiram Presence (has_thiram), classes=[0, 1], samples=901
    RF: F1=0.811±0.125, BA=0.793±0.112, Acc=0.858±0.094

  Task: MG Presence (has_mg), classes=[0, 1], samples=901
    RF: F1=0.785±0.059, BA=0.766±0.056, Acc=0.847±0.045

  Task: MBA Presence (has_mba), classes=[0, 1], samples=901
    RF: F1=0.880±0.072, BA=0.879±0.070, Acc=0.910±0.062

  Task: Thiram Positive Molar Grade (c_thiram), classes=[4, 5, 6], samples=650
    RF: F1=0.790±0.113, BA=0.837±0.085, Acc=0.787±0.119

  Task: MG Positive Molar Grade (c_mg), classes=[4, 5, 6], samples=648
    RF: F1=0.481±0.092, BA=0.513±0.122, Acc=0.569±0.143

  Task: MBA Positive Molar Grade (c_mba), classes=[4, 5, 6], samples=681
    RF: F1=0.781±0.067, BA=0.792±0.062, Acc=0.771±0.081
[I 2026-05-18 17:20:40,475] Trial 37 finished with values: [0.48106636207711234, 0.7548081111669127] and parameters: {'n_estimators': 500, 'max_depth': 30, 'min_samples_leaf': 1, 'max_features': 0.35502298854208525, 'class_weight': 'balanced'}.

  Task: Thiram Presence (has_thiram), classes=[0, 1], samples=901
    RF: F1=0.854±0.081, BA=0.854±0.078, Acc=0.879±0.079

  Task: MG Presence (has_mg), classes=[0, 1], samples=901
    RF: F1=0.804±0.080, BA=0.800±0.074, Acc=0.848±0.067

  Task: MBA Presence (has_mba), classes=[0, 1], samples=901
    RF: F1=0.870±0.074, BA=0.873±0.073, Acc=0.901±0.066

  Task: Thiram Positive Molar Grade (c_thiram), classes=[4, 5, 6], samples=650
    RF: F1=0.782±0.108, BA=0.827±0.087, Acc=0.780±0.112

  Task: MG Positive Molar Grade (c_mg), classes=[4, 5, 6], samples=648
    RF: F1=0.484±0.088, BA=0.516±0.115, Acc=0.578±0.153

  Task: MBA Positive Molar Grade (c_mba), classes=[4, 5, 6], samples=681
    RF: F1=0.788±0.066, BA=0.801±0.057, Acc=0.781±0.074
[I 2026-05-18 17:21:52,752] Trial 38 finished with values: [0.4841893629887636, 0.7636046585912468] and parameters: {'n_estimators': 500, 'max_depth': 22, 'min_samples_leaf': 8, 'max_features': 0.36500891374159283, 'class_weight': 'balanced_subsample'}.

  Task: Thiram Presence (has_thiram), classes=[0, 1], samples=901
    RF: F1=0.851±0.091, BA=0.850±0.091, Acc=0.879±0.084

  Task: MG Presence (has_mg), classes=[0, 1], samples=901
    RF: F1=0.801±0.077, BA=0.791±0.073, Acc=0.850±0.060

  Task: MBA Presence (has_mba), classes=[0, 1], samples=901
    RF: F1=0.873±0.070, BA=0.875±0.069, Acc=0.903±0.063

  Task: Thiram Positive Molar Grade (c_thiram), classes=[4, 5, 6], samples=650
    RF: F1=0.783±0.109, BA=0.830±0.084, Acc=0.780±0.114

  Task: MG Positive Molar Grade (c_mg), classes=[4, 5, 6], samples=648
    RF: F1=0.488±0.093, BA=0.519±0.120, Acc=0.583±0.154

  Task: MBA Positive Molar Grade (c_mba), classes=[4, 5, 6], samples=681
    RF: F1=0.783±0.070, BA=0.796±0.062, Acc=0.774±0.080
[I 2026-05-18 17:24:25,116] Trial 39 finished with values: [0.4875603386369537, 0.7630503676772129] and parameters: {'n_estimators': 1100, 'max_depth': 17, 'min_samples_leaf': 5, 'max_features': 0.3493192507310232, 'class_weight': 'balanced_subsample'}.

  Task: Thiram Presence (has_thiram), classes=[0, 1], samples=901
    RF: F1=0.855±0.091, BA=0.855±0.090, Acc=0.880±0.087

  Task: MG Presence (has_mg), classes=[0, 1], samples=901
    RF: F1=0.797±0.079, BA=0.790±0.073, Acc=0.846±0.062

  Task: MBA Presence (has_mba), classes=[0, 1], samples=901
    RF: F1=0.875±0.069, BA=0.877±0.068, Acc=0.905±0.062

  Task: Thiram Positive Molar Grade (c_thiram), classes=[4, 5, 6], samples=650                                                   40%|████      | 40/100 [51:28<1:35:44, 95.75s/it] 41%|████      | 41/100 [51:28<1:26:22, 87.85s/it]                                                   41%|████      | 41/100 [52:31<1:26:22, 87.85s/it] 42%|████▏     | 42/100 [52:31<1:17:43, 80.40s/it]                                                   42%|████▏     | 42/100 [55:08<1:17:43, 80.40s/it] 43%|████▎     | 43/100 [55:08<1:38:16, 103.45s/it]                                                    43%|████▎     | 43/100 [56:40<1:38:16, 103.45s/it] 44%|████▍     | 44/100 [56:40<1:33:17, 99.96s/it]                                                    44%|████▍     | 44/100 [57:37<1:33:17, 99.96s/it] 45%|████▌     | 45/100 [57:37<1:19:52, 87.14s/it]                                                   45%|████▌     | 45/100 [58:44<1:19:52, 87.14s/it] 46%|████▌     | 46/100 [58:44<1:12:57, 81.07s/it]                                                   46%|████▌     | 46/100 [1:00:13<1:12:57, 81.07s/it] 47%|████▋     | 47/100 [1:00:13<1:13:41, 83.43s/it]                                                     47%|████▋     | 47/100 [1:01:21<1:13:41, 83.43s/it] 48%|████▊     | 48/100 [1:01:21<1:08:19, 78.84s/it]
    RF: F1=0.783±0.108, BA=0.828±0.085, Acc=0.780±0.114

  Task: MG Positive Molar Grade (c_mg), classes=[4, 5, 6], samples=648
    RF: F1=0.491±0.094, BA=0.524±0.121, Acc=0.587±0.155

  Task: MBA Positive Molar Grade (c_mba), classes=[4, 5, 6], samples=681
    RF: F1=0.789±0.069, BA=0.801±0.061, Acc=0.779±0.079
[I 2026-05-18 17:25:34,524] Trial 40 finished with values: [0.4908651009569535, 0.7648447221642928] and parameters: {'n_estimators': 500, 'max_depth': 12, 'min_samples_leaf': 6, 'max_features': 0.35502298854208525, 'class_weight': 'balanced'}.

  Task: Thiram Presence (has_thiram), classes=[0, 1], samples=901
    RF: F1=0.855±0.091, BA=0.855±0.089, Acc=0.882±0.084

  Task: MG Presence (has_mg), classes=[0, 1], samples=901
    RF: F1=0.805±0.067, BA=0.789±0.063, Acc=0.857±0.052

  Task: MBA Presence (has_mba), classes=[0, 1], samples=901
    RF: F1=0.884±0.064, BA=0.882±0.064, Acc=0.912±0.056

  Task: Thiram Positive Molar Grade (c_thiram), classes=[4, 5, 6], samples=650
    RF: F1=0.787±0.108, BA=0.835±0.084, Acc=0.785±0.113

  Task: MG Positive Molar Grade (c_mg), classes=[4, 5, 6], samples=648
    RF: F1=0.477±0.091, BA=0.510±0.119, Acc=0.569±0.142

  Task: MBA Positive Molar Grade (c_mba), classes=[4, 5, 6], samples=681
    RF: F1=0.784±0.076, BA=0.796±0.069, Acc=0.774±0.088
[I 2026-05-18 17:26:37,541] Trial 41 finished with values: [0.47729627114596, 0.7653136859397295] and parameters: {'n_estimators': 300, 'max_depth': 10, 'min_samples_leaf': 3, 'max_features': 0.4887128330883843, 'class_weight': 'balanced_subsample'}.

  Task: Thiram Presence (has_thiram), classes=[0, 1], samples=901
    RF: F1=0.852±0.087, BA=0.849±0.084, Acc=0.880±0.080

  Task: MG Presence (has_mg), classes=[0, 1], samples=901
    RF: F1=0.798±0.070, BA=0.787±0.065, Acc=0.849±0.055

  Task: MBA Presence (has_mba), classes=[0, 1], samples=901
    RF: F1=0.871±0.073, BA=0.873±0.071, Acc=0.902±0.064

  Task: Thiram Positive Molar Grade (c_thiram), classes=[4, 5, 6], samples=650
    RF: F1=0.787±0.110, BA=0.836±0.083, Acc=0.784±0.116

  Task: MG Positive Molar Grade (c_mg), classes=[4, 5, 6], samples=648
    RF: F1=0.487±0.095, BA=0.519±0.123, Acc=0.584±0.155

  Task: MBA Positive Molar Grade (c_mba), classes=[4, 5, 6], samples=681
    RF: F1=0.781±0.072, BA=0.794±0.065, Acc=0.771±0.083
[I 2026-05-18 17:29:14,767] Trial 42 finished with values: [0.48748580712560285, 0.7628421828673061] and parameters: {'n_estimators': 1200, 'max_depth': 34, 'min_samples_leaf': 4, 'max_features': 0.3394633936788146, 'class_weight': 'balanced'}.

  Task: Thiram Presence (has_thiram), classes=[0, 1], samples=901
    RF: F1=0.852±0.086, BA=0.852±0.085, Acc=0.878±0.083

  Task: MG Presence (has_mg), classes=[0, 1], samples=901
    RF: F1=0.801±0.079, BA=0.796±0.073, Acc=0.848±0.064

  Task: MBA Presence (has_mba), classes=[0, 1], samples=901
    RF: F1=0.871±0.072, BA=0.872±0.069, Acc=0.902±0.064

  Task: Thiram Positive Molar Grade (c_thiram), classes=[4, 5, 6], samples=650
    RF: F1=0.784±0.109, BA=0.829±0.085, Acc=0.782±0.114

  Task: MG Positive Molar Grade (c_mg), classes=[4, 5, 6], samples=648
    RF: F1=0.484±0.090, BA=0.516±0.117, Acc=0.578±0.154

  Task: MBA Positive Molar Grade (c_mba), classes=[4, 5, 6], samples=681
    RF: F1=0.786±0.070, BA=0.799±0.061, Acc=0.778±0.078
[I 2026-05-18 17:30:46,584] Trial 43 finished with values: [0.48417285102446045, 0.7631689284914934] and parameters: {'n_estimators': 600, 'max_depth': 15, 'min_samples_leaf': 7, 'max_features': 0.3916028672163949, 'class_weight': 'balanced_subsample'}.

  Task: Thiram Presence (has_thiram), classes=[0, 1], samples=901
    RF: F1=0.851±0.088, BA=0.849±0.082, Acc=0.879±0.081

  Task: MG Presence (has_mg), classes=[0, 1], samples=901
    RF: F1=0.811±0.077, BA=0.804±0.074, Acc=0.856±0.064

  Task: MBA Presence (has_mba), classes=[0, 1], samples=901
    RF: F1=0.872±0.071, BA=0.880±0.076, Acc=0.902±0.063

  Task: Thiram Positive Molar Grade (c_thiram), classes=[4, 5, 6], samples=650
    RF: F1=0.791±0.110, BA=0.839±0.083, Acc=0.788±0.115

  Task: MG Positive Molar Grade (c_mg), classes=[4, 5, 6], samples=648
    RF: F1=0.498±0.086, BA=0.527±0.114, Acc=0.588±0.150

  Task: MBA Positive Molar Grade (c_mba), classes=[4, 5, 6], samples=681
    RF: F1=0.789±0.074, BA=0.799±0.069, Acc=0.777±0.087
[I 2026-05-18 17:31:43,810] Trial 44 finished with values: [0.4979936963797334, 0.768752461683222] and parameters: {'n_estimators': 600, 'max_depth': 16, 'min_samples_leaf': 5, 'max_features': 0.20071291833014568, 'class_weight': 'balanced'}.

  Task: Thiram Presence (has_thiram), classes=[0, 1], samples=901
    RF: F1=0.848±0.091, BA=0.848±0.090, Acc=0.876±0.086

  Task: MG Presence (has_mg), classes=[0, 1], samples=901
    RF: F1=0.804±0.081, BA=0.798±0.077, Acc=0.850±0.067

  Task: MBA Presence (has_mba), classes=[0, 1], samples=901
    RF: F1=0.873±0.071, BA=0.876±0.071, Acc=0.903±0.063

  Task: Thiram Positive Molar Grade (c_thiram), classes=[4, 5, 6], samples=650
    RF: F1=0.787±0.109, BA=0.833±0.083, Acc=0.784±0.114

  Task: MG Positive Molar Grade (c_mg), classes=[4, 5, 6], samples=648
    RF: F1=0.487±0.093, BA=0.519±0.120, Acc=0.583±0.154

  Task: MBA Positive Molar Grade (c_mba), classes=[4, 5, 6], samples=681
    RF: F1=0.786±0.069, BA=0.798±0.061, Acc=0.776±0.079
[I 2026-05-18 17:32:50,713] Trial 45 finished with values: [0.4873987251676361, 0.7642540557975716] and parameters: {'n_estimators': 500, 'max_depth': 34, 'min_samples_leaf': 6, 'max_features': 0.3394633936788146, 'class_weight': 'balanced'}.

  Task: Thiram Presence (has_thiram), classes=[0, 1], samples=901
    RF: F1=0.856±0.081, BA=0.854±0.077, Acc=0.883±0.076

  Task: MG Presence (has_mg), classes=[0, 1], samples=901
    RF: F1=0.816±0.078, BA=0.813±0.073, Acc=0.858±0.064

  Task: MBA Presence (has_mba), classes=[0, 1], samples=901
    RF: F1=0.864±0.071, BA=0.872±0.077, Acc=0.897±0.063

  Task: Thiram Positive Molar Grade (c_thiram), classes=[4, 5, 6], samples=650
    RF: F1=0.784±0.106, BA=0.832±0.082, Acc=0.781±0.110

  Task: MG Positive Molar Grade (c_mg), classes=[4, 5, 6], samples=648
    RF: F1=0.505±0.087, BA=0.534±0.115, Acc=0.595±0.151

  Task: MBA Positive Molar Grade (c_mba), classes=[4, 5, 6], samples=681
    RF: F1=0.792±0.072, BA=0.802±0.066, Acc=0.782±0.082
[I 2026-05-18 17:34:19,658] Trial 46 finished with values: [0.504595946713747, 0.7693353939478342] and parameters: {'n_estimators': 800, 'max_depth': 16, 'min_samples_leaf': 7, 'max_features': 0.17462802355441434, 'class_weight': 'balanced_subsample'}.

  Task: Thiram Presence (has_thiram), classes=[0, 1], samples=901
    RF: F1=0.856±0.077, BA=0.850±0.066, Acc=0.884±0.071

  Task: MG Presence (has_mg), classes=[0, 1], samples=901
    RF: F1=0.815±0.068, BA=0.805±0.063, Acc=0.861±0.053

  Task: MBA Presence (has_mba), classes=[0, 1], samples=901
    RF: F1=0.869±0.065, BA=0.875±0.071, Acc=0.901±0.058

  Task: Thiram Positive Molar Grade (c_thiram), classes=[4, 5, 6], samples=650
    RF: F1=0.790±0.112, BA=0.837±0.085, Acc=0.786±0.117

  Task: MG Positive Molar Grade (c_mg), classes=[4, 5, 6], samples=648
    RF: F1=0.499±0.090, BA=0.528±0.118, Acc=0.590±0.152

  Task: MBA Positive Molar Grade (c_mba), classes=[4, 5, 6], samples=681
    RF: F1=0.786±0.078, BA=0.796±0.074, Acc=0.774±0.091
[I 2026-05-18 17:35:27,798] Trial 47 finished with values: [0.49917018456040657, 0.7690893853024748] and parameters: {'n_estimators': 600, 'max_depth': 16, 'min_samples_leaf': 4, 'max_features': 0.15579754426081674, 'class_weight': 'balanced_subsample'}.

  Task: Thiram Presence (has_thiram), classes=[0, 1], samples=901
    RF: F1=0.823±0.104, BA=0.807±0.090, Acc=0.864±0.085

  Task: MG Presence (has_mg), classes=[0, 1], samples=901
    RF: F1=0.817±0.068, BA=0.807±0.064, Acc=0.862±0.054

  Task: MBA Presence (has_mba), classes=[0, 1], samples=901
    RF: F1=0.868±0.070, BA=0.874±0.075, Acc=0.900±0.062

  Task: Thiram Positive Molar Grade (c_thiram), classes=[4, 5, 6], samples=650
    RF: F1=0.792±0.110, BA=0.842±0.082, Acc=0.788±0.115

  Task: MG Positive Molar Grade (c_mg), classes=[4, 5, 6], samples=648                                                     48%|████▊     | 48/100 [1:02:15<1:08:19, 78.84s/it] 49%|████▉     | 49/100 [1:02:15<1:00:47, 71.52s/it]                                                     49%|████▉     | 49/100 [1:02:42<1:00:47, 71.52s/it] 50%|█████     | 50/100 [1:02:42<48:29, 58.20s/it]                                                     50%|█████     | 50/100 [1:03:51<48:29, 58.20s/it] 51%|█████     | 51/100 [1:03:51<50:02, 61.29s/it]                                                   51%|█████     | 51/100 [1:05:19<50:02, 61.29s/it] 52%|█████▏    | 52/100 [1:05:19<55:26, 69.30s/it]                                                   52%|█████▏    | 52/100 [1:06:26<55:26, 69.30s/it] 53%|█████▎    | 53/100 [1:06:26<53:50, 68.74s/it]                                                   53%|█████▎    | 53/100 [1:09:22<53:50, 68.74s/it] 54%|█████▍    | 54/100 [1:09:22<1:17:18, 100.84s/it]                                                      54%|█████▍    | 54/100 [1:10:31<1:17:18, 100.84s/it] 55%|█████▌    | 55/100 [1:10:31<1:08:21, 91.15s/it]                                                      55%|█████▌    | 55/100 [1:11:29<1:08:21, 91.15s/it] 56%|█████▌    | 56/100 [1:11:29<59:37, 81.30s/it]  
    RF: F1=0.495±0.092, BA=0.525±0.120, Acc=0.589±0.153

  Task: MBA Positive Molar Grade (c_mba), classes=[4, 5, 6], samples=681
    RF: F1=0.787±0.077, BA=0.798±0.072, Acc=0.775±0.090
[I 2026-05-18 17:36:22,240] Trial 48 finished with values: [0.4951069617040803, 0.763648600641241] and parameters: {'n_estimators': 600, 'max_depth': 12, 'min_samples_leaf': 4, 'max_features': 0.17462802355441434, 'class_weight': 'balanced'}.

  Task: Thiram Presence (has_thiram), classes=[0, 1], samples=901
    RF: F1=0.861±0.081, BA=0.861±0.078, Acc=0.887±0.074

  Task: MG Presence (has_mg), classes=[0, 1], samples=901
    RF: F1=0.806±0.071, BA=0.802±0.063, Acc=0.851±0.053

  Task: MBA Presence (has_mba), classes=[0, 1], samples=901
    RF: F1=0.865±0.071, BA=0.872±0.078, Acc=0.899±0.062

  Task: Thiram Positive Molar Grade (c_thiram), classes=[4, 5, 6], samples=650
    RF: F1=0.785±0.110, BA=0.834±0.085, Acc=0.783±0.114

  Task: MG Positive Molar Grade (c_mg), classes=[4, 5, 6], samples=648
    RF: F1=0.492±0.094, BA=0.518±0.120, Acc=0.582±0.152

  Task: MBA Positive Molar Grade (c_mba), classes=[4, 5, 6], samples=681
    RF: F1=0.786±0.078, BA=0.796±0.075, Acc=0.774±0.092
[I 2026-05-18 17:36:49,336] Trial 49 finished with values: [0.49247910225174907, 0.7659391218051778] and parameters: {'n_estimators': 300, 'max_depth': 17, 'min_samples_leaf': 5, 'max_features': 0.12059150049999574, 'class_weight': 'balanced'}.

  Task: Thiram Presence (has_thiram), classes=[0, 1], samples=901
    RF: F1=0.855±0.085, BA=0.853±0.082, Acc=0.883±0.079

  Task: MG Presence (has_mg), classes=[0, 1], samples=901
    RF: F1=0.818±0.079, BA=0.816±0.074, Acc=0.859±0.063

  Task: MBA Presence (has_mba), classes=[0, 1], samples=901
    RF: F1=0.867±0.070, BA=0.875±0.074, Acc=0.899±0.063

  Task: Thiram Positive Molar Grade (c_thiram), classes=[4, 5, 6], samples=650
    RF: F1=0.783±0.108, BA=0.830±0.085, Acc=0.780±0.112

  Task: MG Positive Molar Grade (c_mg), classes=[4, 5, 6], samples=648
    RF: F1=0.501±0.087, BA=0.530±0.114, Acc=0.592±0.150

  Task: MBA Positive Molar Grade (c_mba), classes=[4, 5, 6], samples=681
    RF: F1=0.791±0.075, BA=0.802±0.068, Acc=0.779±0.086
[I 2026-05-18 17:37:57,833] Trial 50 finished with values: [0.5012275588811146, 0.7692107271351438] and parameters: {'n_estimators': 800, 'max_depth': 11, 'min_samples_leaf': 7, 'max_features': 0.17462802355441434, 'class_weight': 'balanced'}.

  Task: Thiram Presence (has_thiram), classes=[0, 1], samples=901
    RF: F1=0.848±0.094, BA=0.846±0.090, Acc=0.877±0.085

  Task: MG Presence (has_mg), classes=[0, 1], samples=901
    RF: F1=0.812±0.085, BA=0.810±0.081, Acc=0.855±0.068

  Task: MBA Presence (has_mba), classes=[0, 1], samples=901
    RF: F1=0.871±0.071, BA=0.878±0.074, Acc=0.901±0.063

  Task: Thiram Positive Molar Grade (c_thiram), classes=[4, 5, 6], samples=650
    RF: F1=0.791±0.104, BA=0.836±0.079, Acc=0.788±0.109

  Task: MG Positive Molar Grade (c_mg), classes=[4, 5, 6], samples=648
    RF: F1=0.502±0.093, BA=0.529±0.118, Acc=0.591±0.151

  Task: MBA Positive Molar Grade (c_mba), classes=[4, 5, 6], samples=681
    RF: F1=0.797±0.067, BA=0.810±0.060, Acc=0.789±0.076
[I 2026-05-18 17:39:25,819] Trial 51 finished with values: [0.5022453295399576, 0.7701768888495728] and parameters: {'n_estimators': 800, 'max_depth': 10, 'min_samples_leaf': 8, 'max_features': 0.2114585856946446, 'class_weight': 'balanced_subsample'}.

  Task: Thiram Presence (has_thiram), classes=[0, 1], samples=901
    RF: F1=0.850±0.089, BA=0.848±0.086, Acc=0.879±0.081

  Task: MG Presence (has_mg), classes=[0, 1], samples=901
    RF: F1=0.813±0.079, BA=0.808±0.074, Acc=0.857±0.064

  Task: MBA Presence (has_mba), classes=[0, 1], samples=901
    RF: F1=0.872±0.070, BA=0.879±0.074, Acc=0.902±0.062

  Task: Thiram Positive Molar Grade (c_thiram), classes=[4, 5, 6], samples=650
    RF: F1=0.788±0.106, BA=0.834±0.081, Acc=0.785±0.111

  Task: MG Positive Molar Grade (c_mg), classes=[4, 5, 6], samples=648
    RF: F1=0.498±0.088, BA=0.527±0.116, Acc=0.588±0.151

  Task: MBA Positive Molar Grade (c_mba), classes=[4, 5, 6], samples=681
    RF: F1=0.789±0.073, BA=0.800±0.068, Acc=0.779±0.083
[I 2026-05-18 17:40:33,262] Trial 52 finished with values: [0.4981222921286155, 0.7684565369047359] and parameters: {'n_estimators': 600, 'max_depth': 16, 'min_samples_leaf': 6, 'max_features': 0.1888431241882921, 'class_weight': 'balanced_subsample'}.

  Task: Thiram Presence (has_thiram), classes=[0, 1], samples=901
    RF: F1=0.810±0.126, BA=0.792±0.113, Acc=0.856±0.097

  Task: MG Presence (has_mg), classes=[0, 1], samples=901
    RF: F1=0.799±0.060, BA=0.783±0.057, Acc=0.855±0.044

  Task: MBA Presence (has_mba), classes=[0, 1], samples=901
    RF: F1=0.877±0.068, BA=0.874±0.069, Acc=0.908±0.060

  Task: Thiram Positive Molar Grade (c_thiram), classes=[4, 5, 6], samples=650
    RF: F1=0.789±0.113, BA=0.836±0.086, Acc=0.785±0.119

  Task: MG Positive Molar Grade (c_mg), classes=[4, 5, 6], samples=648
    RF: F1=0.480±0.094, BA=0.511±0.124, Acc=0.568±0.146

  Task: MBA Positive Molar Grade (c_mba), classes=[4, 5, 6], samples=681
    RF: F1=0.784±0.068, BA=0.796±0.061, Acc=0.775±0.080
[I 2026-05-18 17:43:29,004] Trial 53 finished with values: [0.47970971711831184, 0.7564184030446263] and parameters: {'n_estimators': 1100, 'max_depth': 10, 'min_samples_leaf': 2, 'max_features': 0.3916028672163949, 'class_weight': 'balanced_subsample'}.

  Task: Thiram Presence (has_thiram), classes=[0, 1], samples=901
    RF: F1=0.850±0.088, BA=0.847±0.083, Acc=0.878±0.082

  Task: MG Presence (has_mg), classes=[0, 1], samples=901
    RF: F1=0.817±0.081, BA=0.812±0.077, Acc=0.860±0.064

  Task: MBA Presence (has_mba), classes=[0, 1], samples=901
    RF: F1=0.871±0.066, BA=0.878±0.074, Acc=0.902±0.059

  Task: Thiram Positive Molar Grade (c_thiram), classes=[4, 5, 6], samples=650
    RF: F1=0.783±0.108, BA=0.830±0.085, Acc=0.780±0.112

  Task: MG Positive Molar Grade (c_mg), classes=[4, 5, 6], samples=648
    RF: F1=0.501±0.089, BA=0.530±0.117, Acc=0.593±0.151

  Task: MBA Positive Molar Grade (c_mba), classes=[4, 5, 6], samples=681
    RF: F1=0.797±0.066, BA=0.808±0.059, Acc=0.786±0.077
[I 2026-05-18 17:44:37,559] Trial 54 finished with values: [0.5014005583905279, 0.769776102866366] and parameters: {'n_estimators': 600, 'max_depth': 16, 'min_samples_leaf': 6, 'max_features': 0.15795794883648925, 'class_weight': 'balanced_subsample'}.

  Task: Thiram Presence (has_thiram), classes=[0, 1], samples=901
    RF: F1=0.854±0.087, BA=0.852±0.082, Acc=0.880±0.081

  Task: MG Presence (has_mg), classes=[0, 1], samples=901
    RF: F1=0.804±0.082, BA=0.803±0.076, Acc=0.848±0.067

  Task: MBA Presence (has_mba), classes=[0, 1], samples=901
    RF: F1=0.870±0.069, BA=0.877±0.074, Acc=0.901±0.062

  Task: Thiram Positive Molar Grade (c_thiram), classes=[4, 5, 6], samples=650
    RF: F1=0.790±0.106, BA=0.835±0.081, Acc=0.787±0.111

  Task: MG Positive Molar Grade (c_mg), classes=[4, 5, 6], samples=648
    RF: F1=0.498±0.090, BA=0.527±0.117, Acc=0.589±0.153

  Task: MBA Positive Molar Grade (c_mba), classes=[4, 5, 6], samples=681
    RF: F1=0.797±0.069, BA=0.810±0.061, Acc=0.788±0.079
