[I 2026-05-18 18:07:54,299] Trial 73 finished with values: [0.5034842168895937, 0.7700786436351343] and parameters: {'n_estimators': 600, 'max_depth': 11, 'min_samples_leaf': 5, 'max_features': 0.17462802355441434, 'class_weight': 'balanced_subsample'}.

  Task: Thiram Presence (has_thiram), classes=[0, 1], samples=901
    RF: F1=0.859±0.083, BA=0.856±0.077, Acc=0.886±0.076

  Task: MG Presence (has_mg), classes=[0, 1], samples=901
    RF: F1=0.818±0.066, BA=0.808±0.061, Acc=0.862±0.053

  Task: MBA Presence (has_mba), classes=[0, 1], samples=901
    RF: F1=0.873±0.068, BA=0.879±0.073, Acc=0.903±0.061

  Task: Thiram Positive Molar Grade (c_thiram), classes=[4, 5, 6], samples=650
    RF: F1=0.788±0.112, BA=0.836±0.086, Acc=0.785±0.117

  Task: MG Positive Molar Grade (c_mg), classes=[4, 5, 6], samples=648
    RF: F1=0.492±0.094, BA=0.521±0.122, Acc=0.586±0.153

  Task: MBA Positive Molar Grade (c_mba), classes=[4, 5, 6], samples=681
    RF: F1=0.786±0.078, BA=0.797±0.073, Acc=0.774±0.091
[I 2026-05-18 18:08:45,881] Trial 74 finished with values: [0.4918577792232769, 0.7692008817498235] and parameters: {'n_estimators': 600, 'max_depth': 12, 'min_samples_leaf': 4, 'max_features': 0.15579754426081674, 'class_weight': 'balanced'}.

  Task: Thiram Presence (has_thiram), classes=[0, 1], samples=901
    RF: F1=0.853±0.090, BA=0.851±0.087, Acc=0.880±0.083

  Task: MG Presence (has_mg), classes=[0, 1], samples=901
    RF: F1=0.814±0.081, BA=0.813±0.076, Acc=0.855±0.067

  Task: MBA Presence (has_mba), classes=[0, 1], samples=901
    RF: F1=0.866±0.069, BA=0.874±0.074, Acc=0.898±0.062

  Task: Thiram Positive Molar Grade (c_thiram), classes=[4, 5, 6], samples=650
    RF: F1=0.784±0.106, BA=0.832±0.082, Acc=0.781±0.110

  Task: MG Positive Molar Grade (c_mg), classes=[4, 5, 6], samples=648
    RF: F1=0.501±0.089, BA=0.530±0.117, Acc=0.593±0.151

  Task: MBA Positive Molar Grade (c_mba), classes=[4, 5, 6], samples=681
    RF: F1=0.797±0.069, BA=0.809±0.062, Acc=0.788±0.079
[I 2026-05-18 18:10:13,993] Trial 75 finished with values: [0.5013080968853151, 0.7690925000309718] and parameters: {'n_estimators': 800, 'max_depth': 10, 'min_samples_leaf': 8, 'max_features': 0.17462802355441434, 'class_weight': 'balanced_subsample'}.

  Task: Thiram Presence (has_thiram), classes=[0, 1], samples=901
    RF: F1=0.852±0.085, BA=0.853±0.082, Acc=0.877±0.084

  Task: MG Presence (has_mg), classes=[0, 1], samples=901
    RF: F1=0.804±0.084, BA=0.799±0.080, Acc=0.850±0.068

  Task: MBA Presence (has_mba), classes=[0, 1], samples=901
    RF: F1=0.874±0.069, BA=0.874±0.067, Acc=0.905±0.061

  Task: Thiram Positive Molar Grade (c_thiram), classes=[4, 5, 6], samples=650
    RF: F1=0.781±0.109, BA=0.826±0.087, Acc=0.778±0.113

  Task: MG Positive Molar Grade (c_mg), classes=[4, 5, 6], samples=648
    RF: F1=0.487±0.090, BA=0.519±0.117, Acc=0.583±0.153

  Task: MBA Positive Molar Grade (c_mba), classes=[4, 5, 6], samples=681
    RF: F1=0.783±0.070, BA=0.796±0.061, Acc=0.775±0.078
[I 2026-05-18 18:12:25,410] Trial 76 finished with values: [0.4873585349670518, 0.7635293615645624] and parameters: {'n_estimators': 800, 'max_depth': 33, 'min_samples_leaf': 7, 'max_features': 0.45093574135239245, 'class_weight': 'balanced_subsample'}.

  Task: Thiram Presence (has_thiram), classes=[0, 1], samples=901
    RF: F1=0.847±0.095, BA=0.847±0.094, Acc=0.875±0.090

  Task: MG Presence (has_mg), classes=[0, 1], samples=901
    RF: F1=0.799±0.080, BA=0.792±0.075, Acc=0.847±0.064

  Task: MBA Presence (has_mba), classes=[0, 1], samples=901
    RF: F1=0.875±0.069, BA=0.877±0.068, Acc=0.905±0.062

  Task: Thiram Positive Molar Grade (c_thiram), classes=[4, 5, 6], samples=650
    RF: F1=0.781±0.108, BA=0.827±0.085, Acc=0.779±0.113

  Task: MG Positive Molar Grade (c_mg), classes=[4, 5, 6], samples=648
    RF: F1=0.489±0.094, BA=0.520±0.122, Acc=0.585±0.155

  Task: MBA Positive Molar Grade (c_mba), classes=[4, 5, 6], samples=681
    RF: F1=0.784±0.071, BA=0.797±0.062, Acc=0.775±0.080
[I 2026-05-18 18:14:14,225] Trial 77 finished with values: [0.4885518895186049, 0.7623833694385262] and parameters: {'n_estimators': 800, 'max_depth': 15, 'min_samples_leaf': 6, 'max_features': 0.3639936184136716, 'class_weight': 'balanced'}.

  Task: Thiram Presence (has_thiram), classes=[0, 1], samples=901
    RF: F1=0.850±0.086, BA=0.850±0.085, Acc=0.878±0.079

  Task: MG Presence (has_mg), classes=[0, 1], samples=901
    RF: F1=0.805±0.082, BA=0.801±0.077, Acc=0.849±0.068

  Task: MBA Presence (has_mba), classes=[0, 1], samples=901
    RF: F1=0.867±0.074, BA=0.872±0.073, Acc=0.899±0.066

  Task: Thiram Positive Molar Grade (c_thiram), classes=[4, 5, 6], samples=650
    RF: F1=0.784±0.108, BA=0.831±0.084, Acc=0.782±0.112

  Task: MG Positive Molar Grade (c_mg), classes=[4, 5, 6], samples=648
    RF: F1=0.491±0.091, BA=0.521±0.119, Acc=0.583±0.154

  Task: MBA Positive Molar Grade (c_mba), classes=[4, 5, 6], samples=681
    RF: F1=0.786±0.067, BA=0.798±0.059, Acc=0.776±0.077
[I 2026-05-18 18:14:53,257] Trial 78 finished with values: [0.4908455444155937, 0.7638510494781444] and parameters: {'n_estimators': 300, 'max_depth': 32, 'min_samples_leaf': 7, 'max_features': 0.3118602313424026, 'class_weight': 'balanced'}.

  Task: Thiram Presence (has_thiram), classes=[0, 1], samples=901
    RF: F1=0.856±0.081, BA=0.854±0.077, Acc=0.883±0.076

  Task: MG Presence (has_mg), classes=[0, 1], samples=901
    RF: F1=0.816±0.078, BA=0.813±0.073, Acc=0.858±0.064

  Task: MBA Presence (has_mba), classes=[0, 1], samples=901
    RF: F1=0.864±0.071, BA=0.872±0.077, Acc=0.897±0.063

  Task: Thiram Positive Molar Grade (c_thiram), classes=[4, 5, 6], samples=650
    RF: F1=0.784±0.106, BA=0.832±0.082, Acc=0.781±0.110

  Task: MG Positive Molar Grade (c_mg), classes=[4, 5, 6], samples=648
    RF: F1=0.505±0.087, BA=0.534±0.115, Acc=0.595±0.151

  Task: MBA Positive Molar Grade (c_mba), classes=[4, 5, 6], samples=681
    RF: F1=0.792±0.072, BA=0.802±0.066, Acc=0.782±0.082
[I 2026-05-18 18:16:21,066] Trial 79 finished with values: [0.504595946713747, 0.7693353939478342] and parameters: {'n_estimators': 800, 'max_depth': 14, 'min_samples_leaf': 7, 'max_features': 0.17462802355441434, 'class_weight': 'balanced_subsample'}.

  Task: Thiram Presence (has_thiram), classes=[0, 1], samples=901
    RF: F1=0.850±0.086, BA=0.848±0.078, Acc=0.877±0.083

  Task: MG Presence (has_mg), classes=[0, 1], samples=901
    RF: F1=0.815±0.086, BA=0.815±0.083, Acc=0.857±0.069

  Task: MBA Presence (has_mba), classes=[0, 1], samples=901
    RF: F1=0.869±0.065, BA=0.876±0.072, Acc=0.900±0.059

  Task: Thiram Positive Molar Grade (c_thiram), classes=[4, 5, 6], samples=650
    RF: F1=0.783±0.108, BA=0.830±0.085, Acc=0.780±0.112

  Task: MG Positive Molar Grade (c_mg), classes=[4, 5, 6], samples=648
    RF: F1=0.498±0.091, BA=0.526±0.118, Acc=0.590±0.151

  Task: MBA Positive Molar Grade (c_mba), classes=[4, 5, 6], samples=681
    RF: F1=0.794±0.070, BA=0.805±0.064, Acc=0.784±0.081
[I 2026-05-18 18:17:27,333] Trial 80 finished with values: [0.4980589144045117, 0.7681323910999082] and parameters: {'n_estimators': 800, 'max_depth': 32, 'min_samples_leaf': 8, 'max_features': 0.15795794883648925, 'class_weight': 'balanced'}. 80%|████████  | 80/100 [1:43:20<26:43, 80.17s/it] 81%|████████  | 81/100 [1:43:20<24:04, 76.00s/it]                                                   81%|████████  | 81/100 [1:43:56<24:04, 76.00s/it] 82%|████████▏ | 82/100 [1:43:56<19:12, 64.01s/it]                                                   82%|████████▏ | 82/100 [1:45:25<19:12, 64.01s/it] 83%|████████▎ | 83/100 [1:45:25<20:14, 71.43s/it]                                                   83%|████████▎ | 83/100 [1:46:53<20:14, 71.43s/it] 84%|████████▍ | 84/100 [1:46:53<20:21, 76.33s/it]                                                   84%|████████▍ | 84/100 [1:48:01<20:21, 76.33s/it] 85%|████████▌ | 85/100 [1:48:01<18:26, 73.76s/it]                                                   85%|████████▌ | 85/100 [1:49:08<18:26, 73.76s/it] 86%|████████▌ | 86/100 [1:49:08<16:44, 71.78s/it]                                                   86%|████████▌ | 86/100 [1:50:15<16:44, 71.78s/it] 87%|████████▋ | 87/100 [1:50:15<15:16, 70.52s/it]                                                   87%|████████▋ | 87/100 [1:51:12<15:16, 70.52s/it] 88%|████████▊ | 88/100 [1:51:12<13:17, 66.48s/it]                                                   88%|████████▊ | 88/100 [1:52:20<13:17, 66.48s/it] 89%|████████▉ | 89/100 [1:52:20<12:13, 66.66s/it]

  Task: Thiram Presence (has_thiram), classes=[0, 1], samples=901
    RF: F1=0.826±0.109, BA=0.809±0.096, Acc=0.868±0.084

  Task: MG Presence (has_mg), classes=[0, 1], samples=901
    RF: F1=0.808±0.056, BA=0.795±0.052, Acc=0.858±0.046

  Task: MBA Presence (has_mba), classes=[0, 1], samples=901
    RF: F1=0.864±0.079, BA=0.868±0.083, Acc=0.898±0.067

  Task: Thiram Positive Molar Grade (c_thiram), classes=[4, 5, 6], samples=650
    RF: F1=0.792±0.110, BA=0.842±0.082, Acc=0.788±0.115

  Task: MG Positive Molar Grade (c_mg), classes=[4, 5, 6], samples=648
    RF: F1=0.494±0.092, BA=0.524±0.121, Acc=0.586±0.151

  Task: MBA Positive Molar Grade (c_mba), classes=[4, 5, 6], samples=681
    RF: F1=0.781±0.075, BA=0.789±0.072, Acc=0.771±0.088
[I 2026-05-18 18:18:03,367] Trial 81 finished with values: [0.493559833937719, 0.7607106265160795] and parameters: {'n_estimators': 300, 'max_depth': 22, 'min_samples_leaf': 3, 'max_features': 0.17462802355441434, 'class_weight': 'balanced_subsample'}.

  Task: Thiram Presence (has_thiram), classes=[0, 1], samples=901
    RF: F1=0.854±0.079, BA=0.850±0.073, Acc=0.882±0.075

  Task: MG Presence (has_mg), classes=[0, 1], samples=901
    RF: F1=0.818±0.081, BA=0.813±0.078, Acc=0.861±0.064

  Task: MBA Presence (has_mba), classes=[0, 1], samples=901
    RF: F1=0.872±0.066, BA=0.879±0.075, Acc=0.903±0.058

  Task: Thiram Positive Molar Grade (c_thiram), classes=[4, 5, 6], samples=650
    RF: F1=0.783±0.108, BA=0.830±0.085, Acc=0.780±0.112

  Task: MG Positive Molar Grade (c_mg), classes=[4, 5, 6], samples=648
    RF: F1=0.500±0.089, BA=0.529±0.117, Acc=0.591±0.151

  Task: MBA Positive Molar Grade (c_mba), classes=[4, 5, 6], samples=681
    RF: F1=0.790±0.070, BA=0.801±0.065, Acc=0.779±0.082
[I 2026-05-18 18:19:32,092] Trial 82 finished with values: [0.5003756959529142, 0.7694913816495667] and parameters: {'n_estimators': 800, 'max_depth': 17, 'min_samples_leaf': 6, 'max_features': 0.15795794883648925, 'class_weight': 'balanced_subsample'}.

  Task: Thiram Presence (has_thiram), classes=[0, 1], samples=901
    RF: F1=0.856±0.081, BA=0.854±0.077, Acc=0.883±0.076

  Task: MG Presence (has_mg), classes=[0, 1], samples=901
    RF: F1=0.816±0.078, BA=0.813±0.073, Acc=0.858±0.064

  Task: MBA Presence (has_mba), classes=[0, 1], samples=901
    RF: F1=0.864±0.071, BA=0.872±0.077, Acc=0.897±0.063

  Task: Thiram Positive Molar Grade (c_thiram), classes=[4, 5, 6], samples=650
    RF: F1=0.784±0.106, BA=0.832±0.082, Acc=0.781±0.110

  Task: MG Positive Molar Grade (c_mg), classes=[4, 5, 6], samples=648
    RF: F1=0.505±0.087, BA=0.534±0.115, Acc=0.595±0.151

  Task: MBA Positive Molar Grade (c_mba), classes=[4, 5, 6], samples=681
    RF: F1=0.792±0.072, BA=0.802±0.066, Acc=0.782±0.082
[I 2026-05-18 18:20:59,882] Trial 83 finished with values: [0.504595946713747, 0.7693353939478342] and parameters: {'n_estimators': 800, 'max_depth': 16, 'min_samples_leaf': 7, 'max_features': 0.1746074041599417, 'class_weight': 'balanced_subsample'}.

  Task: Thiram Presence (has_thiram), classes=[0, 1], samples=901
    RF: F1=0.857±0.077, BA=0.854±0.071, Acc=0.885±0.071

  Task: MG Presence (has_mg), classes=[0, 1], samples=901
    RF: F1=0.816±0.073, BA=0.811±0.068, Acc=0.859±0.060

  Task: MBA Presence (has_mba), classes=[0, 1], samples=901
    RF: F1=0.872±0.067, BA=0.880±0.076, Acc=0.903±0.059

  Task: Thiram Positive Molar Grade (c_thiram), classes=[4, 5, 6], samples=650
    RF: F1=0.787±0.110, BA=0.834±0.086, Acc=0.784±0.115

  Task: MG Positive Molar Grade (c_mg), classes=[4, 5, 6], samples=648
    RF: F1=0.503±0.088, BA=0.533±0.116, Acc=0.594±0.151

  Task: MBA Positive Molar Grade (c_mba), classes=[4, 5, 6], samples=681
    RF: F1=0.784±0.073, BA=0.795±0.069, Acc=0.774±0.085
[I 2026-05-18 18:22:07,636] Trial 84 finished with values: [0.5034842168895937, 0.7700786436351343] and parameters: {'n_estimators': 600, 'max_depth': 11, 'min_samples_leaf': 5, 'max_features': 0.17462802355441434, 'class_weight': 'balanced_subsample'}.

  Task: Thiram Presence (has_thiram), classes=[0, 1], samples=901
    RF: F1=0.853±0.083, BA=0.850±0.080, Acc=0.881±0.078

  Task: MG Presence (has_mg), classes=[0, 1], samples=901
    RF: F1=0.817±0.078, BA=0.815±0.073, Acc=0.858±0.066

  Task: MBA Presence (has_mba), classes=[0, 1], samples=901
    RF: F1=0.866±0.073, BA=0.873±0.077, Acc=0.898±0.064

  Task: Thiram Positive Molar Grade (c_thiram), classes=[4, 5, 6], samples=650
    RF: F1=0.784±0.106, BA=0.832±0.082, Acc=0.781±0.110

  Task: MG Positive Molar Grade (c_mg), classes=[4, 5, 6], samples=648
    RF: F1=0.503±0.088, BA=0.532±0.117, Acc=0.593±0.152

  Task: MBA Positive Molar Grade (c_mba), classes=[4, 5, 6], samples=681
    RF: F1=0.794±0.070, BA=0.804±0.065, Acc=0.785±0.080
[I 2026-05-18 18:23:14,795] Trial 85 finished with values: [0.502632117139983, 0.7694513391941911] and parameters: {'n_estimators': 600, 'max_depth': 28, 'min_samples_leaf': 7, 'max_features': 0.17462802355441434, 'class_weight': 'balanced_subsample'}.

  Task: Thiram Presence (has_thiram), classes=[0, 1], samples=901
    RF: F1=0.850±0.092, BA=0.847±0.089, Acc=0.878±0.085

  Task: MG Presence (has_mg), classes=[0, 1], samples=901
    RF: F1=0.814±0.080, BA=0.813±0.075, Acc=0.855±0.067

  Task: MBA Presence (has_mba), classes=[0, 1], samples=901
    RF: F1=0.866±0.069, BA=0.874±0.074, Acc=0.898±0.062

  Task: Thiram Positive Molar Grade (c_thiram), classes=[4, 5, 6], samples=650
    RF: F1=0.784±0.106, BA=0.832±0.082, Acc=0.781±0.110

  Task: MG Positive Molar Grade (c_mg), classes=[4, 5, 6], samples=648
    RF: F1=0.503±0.086, BA=0.533±0.113, Acc=0.594±0.150

  Task: MBA Positive Molar Grade (c_mba), classes=[4, 5, 6], samples=681
    RF: F1=0.796±0.070, BA=0.807±0.063, Acc=0.786±0.079
[I 2026-05-18 18:24:22,382] Trial 86 finished with values: [0.5034839800681835, 0.7687093458088295] and parameters: {'n_estimators': 600, 'max_depth': 14, 'min_samples_leaf': 8, 'max_features': 0.17462802355441434, 'class_weight': 'balanced_subsample'}.

  Task: Thiram Presence (has_thiram), classes=[0, 1], samples=901
    RF: F1=0.852±0.085, BA=0.852±0.079, Acc=0.879±0.080

  Task: MG Presence (has_mg), classes=[0, 1], samples=901
    RF: F1=0.810±0.082, BA=0.809±0.077, Acc=0.852±0.067

  Task: MBA Presence (has_mba), classes=[0, 1], samples=901
    RF: F1=0.870±0.069, BA=0.877±0.074, Acc=0.901±0.062

  Task: Thiram Positive Molar Grade (c_thiram), classes=[4, 5, 6], samples=650
    RF: F1=0.788±0.108, BA=0.833±0.083, Acc=0.785±0.113

  Task: MG Positive Molar Grade (c_mg), classes=[4, 5, 6], samples=648
    RF: F1=0.501±0.092, BA=0.529±0.118, Acc=0.589±0.154

  Task: MBA Positive Molar Grade (c_mba), classes=[4, 5, 6], samples=681
    RF: F1=0.795±0.070, BA=0.806±0.063, Acc=0.785±0.080
[I 2026-05-18 18:25:19,443] Trial 87 finished with values: [0.5013229499746793, 0.7694492595579376] and parameters: {'n_estimators': 600, 'max_depth': 32, 'min_samples_leaf': 8, 'max_features': 0.2114585856946446, 'class_weight': 'balanced'}.

  Task: Thiram Presence (has_thiram), classes=[0, 1], samples=901
    RF: F1=0.855±0.075, BA=0.851±0.072, Acc=0.883±0.071

  Task: MG Presence (has_mg), classes=[0, 1], samples=901
    RF: F1=0.815±0.080, BA=0.813±0.075, Acc=0.857±0.066

  Task: MBA Presence (has_mba), classes=[0, 1], samples=901
    RF: F1=0.865±0.068, BA=0.873±0.075, Acc=0.898±0.061

  Task: Thiram Positive Molar Grade (c_thiram), classes=[4, 5, 6], samples=650
    RF: F1=0.784±0.106, BA=0.832±0.082, Acc=0.781±0.110

  Task: MG Positive Molar Grade (c_mg), classes=[4, 5, 6], samples=648
    RF: F1=0.504±0.088, BA=0.533±0.116, Acc=0.594±0.151

  Task: MBA Positive Molar Grade (c_mba), classes=[4, 5, 6], samples=681
    RF: F1=0.791±0.072, BA=0.801±0.068, Acc=0.781±0.083
[I 2026-05-18 18:26:26,516] Trial 88 finished with values: [0.5036569795775968, 0.769021350418678] and parameters: {'n_estimators': 600, 'max_depth': 10, 'min_samples_leaf': 6, 'max_features': 0.17462802355441434, 'class_weight': 'balanced_subsample'}.

  Task: Thiram Presence (has_thiram), classes=[0, 1], samples=901                                                   89%|████████▉ | 89/100 [1:52:56<12:13, 66.66s/it] 90%|█████████ | 90/100 [1:52:56<09:36, 57.66s/it]                                                   90%|█████████ | 90/100 [1:54:13<09:36, 57.66s/it] 91%|█████████ | 91/100 [1:54:13<09:31, 63.49s/it]                                                   91%|█████████ | 91/100 [1:55:41<09:31, 63.49s/it] 92%|█████████▏| 92/100 [1:55:41<09:25, 70.63s/it]                                                   92%|█████████▏| 92/100 [1:56:49<09:25, 70.63s/it] 93%|█████████▎| 93/100 [1:56:49<08:08, 69.83s/it]                                                   93%|█████████▎| 93/100 [1:58:48<08:08, 69.83s/it] 94%|█████████▍| 94/100 [1:58:48<08:27, 84.66s/it]                                                   94%|█████████▍| 94/100 [1:59:25<08:27, 84.66s/it] 95%|█████████▌| 95/100 [1:59:25<05:51, 70.33s/it]                                                   95%|█████████▌| 95/100 [2:00:52<05:51, 70.33s/it] 96%|█████████▌| 96/100 [2:00:52<05:02, 75.56s/it]                                                   96%|█████████▌| 96/100 [2:02:22<05:02, 75.56s/it] 97%|█████████▋| 97/100 [2:02:22<03:58, 79.60s/it]
    RF: F1=0.853±0.087, BA=0.853±0.077, Acc=0.880±0.080

  Task: MG Presence (has_mg), classes=[0, 1], samples=901
    RF: F1=0.808±0.088, BA=0.807±0.083, Acc=0.850±0.072

  Task: MBA Presence (has_mba), classes=[0, 1], samples=901
    RF: F1=0.868±0.070, BA=0.874±0.074, Acc=0.900±0.062

  Task: Thiram Positive Molar Grade (c_thiram), classes=[4, 5, 6], samples=650
    RF: F1=0.786±0.106, BA=0.833±0.082, Acc=0.783±0.110

  Task: MG Positive Molar Grade (c_mg), classes=[4, 5, 6], samples=648
    RF: F1=0.498±0.093, BA=0.524±0.118, Acc=0.587±0.151

  Task: MBA Positive Molar Grade (c_mba), classes=[4, 5, 6], samples=681
    RF: F1=0.798±0.067, BA=0.809±0.061, Acc=0.789±0.076
[I 2026-05-18 18:27:03,185] Trial 89 finished with values: [0.497698579184137, 0.7684493644996987] and parameters: {'n_estimators': 300, 'max_depth': 33, 'min_samples_leaf': 8, 'max_features': 0.2114585856946446, 'class_weight': 'balanced_subsample'}.

  Task: Thiram Presence (has_thiram), classes=[0, 1], samples=901
    RF: F1=0.853±0.094, BA=0.851±0.090, Acc=0.880±0.086

  Task: MG Presence (has_mg), classes=[0, 1], samples=901
    RF: F1=0.808±0.080, BA=0.806±0.075, Acc=0.851±0.066

  Task: MBA Presence (has_mba), classes=[0, 1], samples=901
    RF: F1=0.871±0.068, BA=0.877±0.075, Acc=0.902±0.060

  Task: Thiram Positive Molar Grade (c_thiram), classes=[4, 5, 6], samples=650
    RF: F1=0.788±0.108, BA=0.833±0.083, Acc=0.785±0.113

  Task: MG Positive Molar Grade (c_mg), classes=[4, 5, 6], samples=648
    RF: F1=0.498±0.090, BA=0.527±0.117, Acc=0.589±0.153

  Task: MBA Positive Molar Grade (c_mba), classes=[4, 5, 6], samples=681
    RF: F1=0.794±0.069, BA=0.807±0.061, Acc=0.785±0.079
[I 2026-05-18 18:28:20,272] Trial 90 finished with values: [0.4981444593631618, 0.7687472256583265] and parameters: {'n_estimators': 700, 'max_depth': 22, 'min_samples_leaf': 8, 'max_features': 0.19971689165954998, 'class_weight': 'balanced_subsample'}.

  Task: Thiram Presence (has_thiram), classes=[0, 1], samples=901
    RF: F1=0.856±0.081, BA=0.854±0.077, Acc=0.883±0.076

  Task: MG Presence (has_mg), classes=[0, 1], samples=901
    RF: F1=0.816±0.078, BA=0.813±0.073, Acc=0.858±0.064

  Task: MBA Presence (has_mba), classes=[0, 1], samples=901
    RF: F1=0.864±0.071, BA=0.872±0.077, Acc=0.897±0.063

  Task: Thiram Positive Molar Grade (c_thiram), classes=[4, 5, 6], samples=650
    RF: F1=0.784±0.106, BA=0.832±0.082, Acc=0.781±0.110

  Task: MG Positive Molar Grade (c_mg), classes=[4, 5, 6], samples=648
    RF: F1=0.505±0.087, BA=0.534±0.115, Acc=0.595±0.151

  Task: MBA Positive Molar Grade (c_mba), classes=[4, 5, 6], samples=681
    RF: F1=0.792±0.072, BA=0.802±0.066, Acc=0.782±0.082
[I 2026-05-18 18:29:47,561] Trial 91 finished with values: [0.504595946713747, 0.7693353939478342] and parameters: {'n_estimators': 800, 'max_depth': 24, 'min_samples_leaf': 7, 'max_features': 0.17462802355441434, 'class_weight': 'balanced_subsample'}.

  Task: Thiram Presence (has_thiram), classes=[0, 1], samples=901
    RF: F1=0.820±0.108, BA=0.800±0.097, Acc=0.867±0.078

  Task: MG Presence (has_mg), classes=[0, 1], samples=901
    RF: F1=0.798±0.059, BA=0.782±0.055, Acc=0.852±0.048

  Task: MBA Presence (has_mba), classes=[0, 1], samples=901
    RF: F1=0.864±0.073, BA=0.868±0.079, Acc=0.898±0.063

  Task: Thiram Positive Molar Grade (c_thiram), classes=[4, 5, 6], samples=650
    RF: F1=0.797±0.113, BA=0.844±0.084, Acc=0.793±0.119

  Task: MG Positive Molar Grade (c_mg), classes=[4, 5, 6], samples=648
    RF: F1=0.482±0.097, BA=0.512±0.126, Acc=0.573±0.150

  Task: MBA Positive Molar Grade (c_mba), classes=[4, 5, 6], samples=681
    RF: F1=0.785±0.073, BA=0.795±0.069, Acc=0.775±0.087
